title,lyrics,release_date,Album,release_year,Word Count
Wings,mama told waste life said spread wings little butterfly keep night give walk  jesy jade feet feet touch ground hear sound keep running mouth yeah walk walk there cause care yeah  leigh anne perrie your words mean thing listening keep talking know  perrie jade mama told waste life said spread wings little butterfly keep night detain cause wings made nobody bring down down matter hurt matter fall these wings made  perrie leigh anne firing runway know gonna someday need ready steady talk talk turns even care yeah  leigh anne perrie your words mean thing listening keep talking know  perrie mama told waste life said spread wings little butterfly keep night detain cause wings made nobody bring down down down matter hurt matter fall these wings made bridge leigh anne need sayin hear sayin better keep walkin wanna hear talking better keep walkin wanna hear talking  perrie your words mean thing mean thing listening listening they like water wings  perrie mama told waste life woah said spread wings little butterfly little butterfly keep night detain they detain cause wings made nobody bring down down down matter hurt woah matter fall woah these wings made  perrie nobody bring down down matter hurt matter fall these wings made,2012-08-04,Between Us,2012,215
Holiday,jesy told swear when cold pull closer like middle july july  leigh anne wanna little taste down nothing better than skin mine skin mine looking feeling lookin life give every time  jade jade jesy make night stop body babe touch like summer night feel like holiday night stop feel body babe dancing night away feel like holiday post  perrie leigh anne else world could ever come close baby close baby taking slow whenever wherever lasting forever baby turning  jade told give like heat yeah like summer summer that glad made mine  leigh anne wanna little taste down nothing better skin mine skin mine looking feeling lookin life give every time  jade leigh anne jade jade jesy jesy make night stop body babe touch like summer night feel like holiday holiday yeah night stop feel body babe dancing night away feel like holiday post  perrie jesy leigh anne else world could ever come close baby close baby close baby close baby taking slow whenever wherever lasting forever baby turning bridge jesy leigh anne love love touching holding nobody thing like feel like holiday know want babe  jade jade jesy jesy leigh anne make night stop body babe touch like summer night feel like holiday holiday yeah night stop feel body babe dancing night away dancing night away feel like holiday feel like holiday yeah post  perrie jesy leigh anne else world could ever come close baby close baby close baby close baby taking slow slow whenever wherever lasting forever baby turning turning yeah,2020-07-24,Between Us,2020,262
Told You So,jesy  jesy honest feeling girlfriend have cryin again just give time breathe happy that playing pretend said listen finally found  jade that never gonna love like please never gonna find like  girl come round mine tonight wine make wipes hold hold kettle talk bout told never gonna told  leigh anne jade honest best friend hotter yeah jokes lacking content yeah darling better than someone lies cheats scene every week every single club another girl again  perrie know never gonna love like yeah please never gonna find like woah  leigh anne jesy girl come round mine tonight wine make wipes hold hold hold hold kettle talk bout told told never gonna told bridge leigh anne jade jesy perrie never gonna told yeah never gonna told yeah never gonna warned glad know that know know know  jesy perrie leigh anne jade girl come round mine tonight wine make wipes hold hold hold hold yeah kettle talk bout told told baby never gonna told told just come round mine tonight baby come around wine make wipes hold hold hold hold kettle talk bout yeah yeah told never gonna told,2018-11-09,Between Us,2018,194
Salute,jesy jade ladies across world listen looking recruits hands stand salute killer heels sneakers pumps lace boots representing women salute salute ladies across world listen looking recruits hands stand salute killer heels sneakers pumps lace boots representing women salute salute  jade need camouflage female federal taking women hear  ladies across world listen looking recruits hands stand salute killer heels sneakers pumps lace boots representing women salute salute post  attention salute attention salute attention representing women salute salute  leigh anne leigh anne perrie perrie sisters everywhere warriors country needs ready ladies better keep steady ready shoot need ammunition mission truth divas queens need salute sisters everywhere warriors country needs ready ladies better keep steady ready shoot need ammunition mission truth representing women salute salute  jade need camouflage female federal taking women hear  ladies across world listen looking recruits hands stand salute killer heels sneakers pumps lace boots representing women salute salute post  attention salute attention salute attention representing women salute salute bridge leigh anne jade leigh anne jade think pretty things wrong standing strong carry knock again knock keep moving moving yeah stop hurricane ladies time awake yeah breakdown perrie attention listen ladies ladies attention individuals originals listen hear  ladies across world listen looking recruits hands stand salute killer heels sneakers pumps lace boots representing women salute salute post  perrie attention salute attention salute attention representing women salute salute  jesy jade ladies listen ladies listen time come attention begun listen listen listen stand together remember fight great attention women ladies great fighters listen representing women salute salute,2013-11-08,Between Us,2013,268
The Cure,perrie jesy perrie jesy lost faith made mistakes gonna find make easy better believe pain hold back live like that yeah made peace sorrow living tomorrow  jesy jesy perrie leigh anne perrie girl face face life that changed changed know know know know know  little lost anymore little hurt anymore little left anymore cause tears fell down anymore little messed anymore little lucked anymore little gone anymore yeah alright baby cure post  perrie yeah alright baby cure  leigh anne jade yeah yeah yeah need else this happiness always inside lord took minute find freedom found worth million puttin troubles behind need heart guide yeah  leigh anne jade girl face life that changed know know know know know know know  leigh anne jade little lost anymore little lost little hurt anymore woah little left anymore cause tears fell down anymore little messed anymore little lucked anymore little gone anymore yeah alright baby cure cure post  perrie jesy leigh anne alright baby cure cure alright baby cure cure alright baby cure bridge leigh anne learn love again cause cause finally understand  leigh anne jesy jade little lost anymore little little hurt anymore little left anymore little cause tears fell down anymore tears fell down little messed anymore tears fell down little lucked anymore tears fell down little gone anymore yeah alright baby cure baby cure little lost anymore more little hurt anymore more little left anymore more cause tears fell down anymore more more more little messed anymore more little lucked anymore more little gone anymore more yeah alright baby cure post  perrie jesy perrie jesy cure cure cure cure cure cure cure cure yeah alright baby cure cure cure cure yeah alright baby cure,2018-11-13,Between Us,2018,293
Little Me,jade leigh anne lives shadow lonely girl voice quiet hear word always talking heard catch know brave trapped inside scared talk know  jade jade leigh anne wish knew back know wish could somehow back time maybe listen advice  jesy tell speak tell shout talk louder prouder tell beautiful wonderful everything gotta speak gotta shout know right here right beautiful wonderful anything wanna little  jesy perrie yeah time write book single page hands clock turn yeah yeah yeah yeah yeah fast risk afraid take fall felt look small  perrie wish knew back know wish could somehow back time maybe listen advice  jesy perrie jade tell speak tell shout talk louder prouder tell beautiful wonderful everything know right here right gotta speak speak gotta shout shout know right here right beautiful wonderful anything wanna little bridge jade leigh anne little yeah yeah tell thing would woah  leigh anne jade perrie tell speak tell shout talk louder prouder tell beautiful wonderful beautiful wonderful everything shout woah gotta speak gotta shout know right here right beautiful wonderful anything wanna yeah yeah tell speak tell shout little talk louder prouder tell beautiful wonderful everything gotta speak shout know right here right beautiful wonderful anything wanna tell thing would  jade jesy perrie tell speak tell shout woah talk louder prouder tell beautiful wonderful woah everything gotta speak shout shout yeah know right here right beautiful wonderful anything wanna little,2013-11-08,Between Us,2013,241
Oops,perrie oops baby woke oops broke better friends accidentally need know oops baby love  jesy started what messed around caught yeah yeah know feelings like there nothing enough  leigh anne jesy little think touch body know long wait think touch body this could greatest mistake singing  little jesy oops baby woke oops broke better friends accidentally need know oops baby love  charlie jade charlie jade good messed around good guess turns lost good cause wishing every morning would come with next baby yeah  charlie charlie leigh anne think touch body this could greatest mistake singing  leigh anne jade oops oops baby woke woke oops broke better friends accidentally need know oops baby love post  leigh anne perrie love accidentally know love oops baby love yeah yeah yeah yeah bridge jade charlie charlie jade would take time machine said goodbye lied lied again beneficial friends tell goodbye singing  jade perrie oops baby yeah woke oops broke better friends accidentally need know oops baby love love love love  charlie jade oops love love still love singin oops love yeah yeah accidentally know love oops baby love,2016-11-18,Between Us,2016,194
Between Us,jade when curtains close lights down safe stay always stick around crown knocked rock stop never doubt doubt  leigh anne like damn history shared every misery lived every victory yeah synergy hurt hurting that walked fire flames higher made survivors yeah made fighters fighters  perrie here starting nothing comes nothing comes tween swear lose thing found cause love never leave nothing comes post  perrie nothing comes  leigh anne jade perrie remember finally found wings changed lives gave power anything anything every time break break down bounce back every track back never doubt never doubt  perrie jade leigh anne damn history yeah sweet melodies yeah lived every victory yeah synergy hurt hurtin yeah that walked fire fire flames higher yeah made survivors yeah made fighters fighters  jade here here starting here nothing comes between nothing comes swear lose thing found love never leave cause nothing comes post  perrie jade leigh anne nothing comes bridge jade perrie damn history even life moves moves hurt hurtin always  leigh anne leigh anne perrie jade here starting here nothing comes nothing comes swear lose thing found love never leave nothing comes post  perrie leigh anne jade swear lose thing found between  jade when curtains close lights down safe stay always stick around,2021-11-05,Between Us,2021,218
F.U.,jesy jade jesy jade damn night waiting waiting cooked favourite dressed real nice know know kissed came home late breakup speech ready then kiss face persuade  jade jesy leigh anne dirty disgusting nough loving hate really hate momma said date cheatin lyin know hidin cellphones cellphones right  jade sweet talk again wanna friends fool comes  leigh anne jesy jade friends sucker sucker explain complicated wish dead till take good good little mother mother brown eyes body revenge take keys benz  perrie jesy leigh anne dirty disgusting nough loving hate really hate momma said date cheatin lyin know hidin cellphones cellphones right  perrie sweet talk again wanna friends fool comes bridge jesy jesy jade leigh anne perrie wanna shoo shoo wanna screw practice lines mirror then smile that killer love baby need cause drop dead gorgeous cupid coming warn  jesy jesy jade jade perrie dirty disgusting nough loving hate really hate momma said date cheatin lyin know hidin cellphones right  leigh anne jade perrie jade jesy sweet talk again wanna friends wanna friend fool comes,2016-11-02,Between Us,2016,182
Gloves Up,jade purrrup your your gloves purrrup purrrup your your gloves better high  perrie jade sweat carpet blood walls nothing stop stop applause they thought over floor tappin comin more start riot ruckus rage ready rumble scared pain shots body tears face throwing towel runnin away  jesy nobody tell nothing just know gonna startin somethin  perrie eyes prize fight knock that takin moment mine brighter bright shine knock that refrain jesy perrie perrie purrrup your your gloves purrrup purrrup your your gloves better high  leigh anne baby gunnin gunnin gold cause breakin breaking mould rewrite history pages believe that make sure forget change green legend four divas  jade nobody tell nothing just know gonna startin somethin  leigh anne perrie jade leigh anne jade eyes prize fight knock that knock down takin moment mine takin brighter bright shine shine knock that post  jade perrie woah woah refrain jesy perrie leigh anne perrie purrrup your your gloves purrrup purrrup your your gloves better high purrrup your your gloves purrrup purrrup your your gloves better high,2020-11-06,Between Us,2020,180
Woman’s World,jesy every tells daughter baby pretty face says gotta work much harder than every single that  jesy goes every overworked underpaid just cause body made insane  jade never told gotta what gotta wear gotta speak never shouted heard lived woman world gotta change only want body brains think that works lived woman world post  jade living living living living livin woman world  leigh anne every night tells daughter know change gonna come there whisper water know tide gonna turn  leigh anne jade goes every overworked underpaid just cause body made insane  jade perrie never told gotta what gotta wear gotta speak never shouted heard lived woman world that gotta change only want body brains really think that works lived woman world bridge leigh anne jade perrie just look that think ever stop this gonna this gonna know when everyone treated only gotta yeah yeah yeah yeah  jesy perrie jade never told gotta what gotta wear gotta speak never shouted heard lived woman world gotta change only want body brains think that works lived woman world post  jesy leigh anne jade perrie living living living woman world living living woman woman world woman living living living living living yeah woman woman world  jade leigh anne jesy hear living living living living living woman woman world world,2018-11-16,Between Us,2018,225
Lightning,jesy cross desert ocean away pain storm chase sunlight running shadow could heal feel  leigh anne that shooting heart that like dart electricity electricity love tearing apart runnin like light dark electricity keeps hitting  leigh anne lightning strikes twice burns like wish love again lightning strikes twice burns nice wish love post   jade those eyes look enchanted your voice serenade sings heart kiss turned skies grey never away shelter rain  perrie that shooting heart that like dart electricity electricity love tearing apart runnin like light dark electricity keeps hitting  jade jade leigh anne lightning strikes twice burns like wish love again lightning strikes twice burns nice wish love post  jade yeah yeah yeah yeah yeah yeah interlude perrie fortuna velut luna statu variabilis semper crescis decrescis vita detestabilis bridge jesy jade jesy every time hear name baby pleasure pain  perrie lightning strikes twice burns like wish love again post  jade perrie yeah yeah fortuna yeah vita detesta yeah  perrie fortuna velut luna statu variabilis semper crescis decrescis vita detestabilis,2015-10-16,Between Us,2015,180
Monster In Me,jesy leigh anne beautiful creatures every time touch dangerous this spark chemistry beautiful liars drownin deep every night fight like hell feels like heaven sheets  leigh anne every time scream call more  perrie touch kill slowly what baby monster loves monster hold squeeze little tighter till breathe what baby monster loves monster post  perrie jesy monster loves monster  jesy jade beautiful killer deep just single kiss spell like never seen beautiful fire love heat every night fight like hell love make scream  jade every time more more  perrie touch kill slowly what baby monster loves monster hold squeeze little tighter till breathe breathe baby what baby monster loves monster post  perrie jesy jesy monster loves monster yeah bridge leigh anne jade jesy perrie every moment spend turning friends enemies fighting hold other every second fall fire below beautiful hell made other love louder roar crying more know wrong baby just  perrie leigh anne jade jesy touch kill slowly slowly yeah what baby baby monster loves monster loves monster babe hold squeeze little tighter squeeze little tighter till breathe breathe what baby baby monster loves monster  monster yeah wanting haunting haunting haunting wanting haunting woah haunting haunting wanting haunting haunting haunting wanting haunting haunting,2018-11-16,Between Us,2018,213
A Mess (Happy 4 U),perrie blood speak hundred fifty days twenty weeks woah countin though holding hands bond street cute bought woah rockin though  jade know lyin said feel nothin tryna bigger person hard feelin small nobody knows  still mess since left happy happy happy happy guess hard feelings cause love looking good happy happy happy post  jade leigh anne fine yeah yeah yeah yeah peace sign yeah yeah baby fine yeah yeah yeah yeah happy happy happy  leigh anne leigh anne jade wanna sour bittersweet woah taste mouth cause woah time please wanna rude seems sweet tryna cool woah hold tight broken hearted  jade jade leigh anne know lyin said feel nothin drip makeup time emotional nobody knows  perrie still mess since left since left happy happy happy happy guess guess hard feelings cause love looking good happy happy happy post  jade perrie leigh anne jade fine yeah yeah yeah yeah yeah peace sign yeah yeah baby fine yeah yeah yeah yeah happy happy happy bridge jesy check check check check check check walkin check check myself wanna look eyes protect myself cause feelings never check check check check check check walkin check check myself wanna look eyes protect myself cause feelings never breakdown jade leigh anne fine yeah yeah yeah yeah peace sign yeah yeah baby fine yeah yeah yeah yeah happy happy happy woah  perrie leigh anne jade still mess still mess since left since left happy happy happy happy guess guess hard feelings hard feelings cause love looking good happy happy happy woah post  leigh anne perrie jade fine yeah yeah yeah yeah peace sign peace sign yeah yeah baby fine yeah yeah yeah yeah happy happy happy happy fine yeah yeah yeah yeah happy peace sign yeah yeah yeah baby fine yeah yeah yeah yeah yeah yeah yeah happy happy happy,2020-11-06,Between Us,2020,313
More Than Words,kamille perrie jesy when think think think alone like ghost behind when down down when find things know give words when seasons change shines face yeah part part just much part  kamille jade find peace every story told think never alone true true true know  need words save ways explain always same need words  leigh anne perrie jade jesy forget forget forget heart helped through turned turned turned disaster dream gave power made life brand when world break found magic grew stronger every line line line line line every night every night every night stand sing truth know alright alright  kamille jesy find peace every story told think never alone true true true know  kamille need words save ways explain always same need words bridge kamille leigh anne jade perrie woah yeah find peace every story told think never alone true know  kamille leigh anne jade need words more words save ways explain ways explain baby always same always same need words  jesy need words,2018-11-16,Between Us,2018,173
Breathe,jesy baby love more hurts like hell like love myself never feeling before wanna face truth still missing yeah  jade jesy erase number yeah still sleeping jumper yeah kinda hate love tryna  breathe when sleep space leave swear swear swear heart beat when supposed breathe post  perrie breathe breathe breathe breathe  leigh anne every night calling name here ghost haunted close wonder feeling same remember replacing yeah  perrie jade perrie jade call pick call pick yeah guess drowning liquor drowning liquor yeah yeah thought sick show  jesy leigh anne perrie breathe when with sleep space leave space leave swear swear swear heart beat gone when supposed breathe supposed breathe bridge perrie jesy leigh anne jade still erase number yeah still sleeping jumper yeah hate love woah builtup leigh anne perrie breathe when sleep space leave space leave swear swear swear heart beat gone gone when supposed breathe woah  jade leigh anne perrie breathe when with sleep sleep space leave space leave swear swear swear heart beat gone when supposed breathe  jesy leigh anne jade supposed breathe breathe,2020-11-06,Between Us,2020,187
Cut You Off,leigh anne everyone limit really life till walked right walked right only look back pickin flags turn white white  jade cause wanna listen triggered handed scissors everyone limit really pushed there gotta  perrie perrie leigh anne someone tell here used good nothing lasts forever really thought could know there tears worth broken heart protect energy gotta post  jade  leigh anne jade think believe grass really greener happy happy know think that sweet crawl back late late  perrie jade cause wanna listen yeah triggered handed scissors  leigh anne leigh anne perrie jade someone tell here used good used good nothing lasts forever really thought could yeah know there tears worth broken heart tears protect energy gotta post  perrie perrie jade  jade jade leigh anne perrie someone tell here used good nothing lasts forever really thought could know there tears worth broken heart protect energy gotta what best think finally ready snip snip post  leigh anne jade jade leigh anne perrie,2021-11-12,Between Us,2021,169
American Boy,perrie singin singin singin breaks heart know thinks plays guitar american singing singing singing  jesy back californ playin band dancin stage says away never knew real name  leigh anne mean caught insecure bout things mean jealous careless must drive  perrie perrie jesy singin singin singin breaks heart know thinks plays guitar american singin singin singin breaks heart know thinks plays guitar american american post  leigh anne jade american merican merican know american american merican merican know american  jade wanna know phone making paranoid making making making crazy making feel like needed wanna know home home baby alone alone answer phone baby  leigh anne mean caught insecure bout things mean jealous careless must drive  perrie jesy leigh anne jade jesy singin singin singin breaks heart breaks heart know thinks plays guitar american singin singin singin breaks heart yeah know thinks plays guitar american singin singin singin american post  leigh anne jade perrie american merican merican woah know american american merican merican know american bridge jesy jade perrie leigh anne singin know thinks plays guitar when plays guitar breaks heart american  perrie jesy jade leigh anne jesy singin singin singin breaks heart know thinks plays guitar when plays guitar american singin singin singin breaks heart yeah know thinks plays guitar american american post  leigh anne jade perrie jesy american merican merican american merican know american american merican merican know american,2018-11-16,Between Us,2018,239
