title,lyrics,release_date,Album,release_year,Word Count
One I’ve Been Missing,missing missing  jade thirlwall sorry been around mind million times make wrap presents tree together together baby there better gift here that feel most  leigh anne pinnock perrie edwards jade thirlwall cause gone long kept holding cause need show just much love christmas lights eyes they never shone bright waited year near missing this christmas post  leigh anne pinnock missing missing missing missing missing  jesy nelson felt lonely sleep wrong side world snow feet fire scene together dream together baby there better gift have here that feel most  perrie edwards jade thirlwall leigh anne pinnock cause gone long kept holding cause need show just much love christmas lights eyes they never shone bright waited year near missing this christmas post  leigh anne pinnock jesy nelson perrie edwards jade thirlwall missing this christmas missing missing missing this christmas missing missing missing this christmas missing yeah  jesy nelson jade thirlwall missing,2019-11-22,Between Us,2019,157
The National Manthem,bitch made magic pray goddess break promise thou shall faithful honest,2018-11-16,Between Us,2018,12
If You Want My Love,jade sick tired mistakes never give want yeah together want late keep moving babe waiting round forever  leigh anne ringin phone sorry love home cause saturday night vibe baby  perrie leigh anne want love better know work baby give whatever doing enough baby want love  jesy jesy leigh anne come face everything right basic baby pictur need move quicker know want love gotta pleasure make feel like type treasure know potential show special gimme that gimme that  jade ringin phone tryna alone saturday night vibe baby  jesy perrie leigh anne want love better know better know work baby give whatever doin enough baby want love bridge perrie jade should known come first should gave deserve like gave gave there make wish come true refrain jade leigh anne jesy want love want love better know better know gotta work want love want love better know better know gotta work gotta want love  perrie jade leigh anne leigh anne jade want love baby want baby want love better know better know work work gotta work baby give yeah yeah want love better know whatever doing enough enough gotta work baby want love  leigh anne perrie leigh anne want love better know gotta work,2020-11-06,Between Us,2020,209
Beep Beep,jade leigh anne beep beep beep beep  jade leigh anne both stuck traffic bumper bumper babe leather jacket smells like aftershave wanna hands booty beep beep blew engine think broke stick busy dreaming jumping turning good need check hood babe beep beep  perrie perrie jesy baby baby there something love affection going crazy thought driving wild  jade jade leigh anne leigh anne cause love love love making love stuck stuck stuck help help just wanna tonight beep beep baby pump pump pump cause give jump jump jump make start again help help just wanna tonight beep beep  jesy jade leigh anne sexy like cadillac just come cause hold back people street watch backseat beep beep  jade perrie jesy baby baby there something love affection going crazy thought driving wild  perrie jade leigh anne jesy cause love love love making love stuck stuck stuck help help just wanna tonight beep beep baby pump pump pump cause give jump jump jump make start again help help just wanna tonight beep beep bridge jade jade leigh anne jesy push pedal till gone floor running reds like would push pedal till gone floor gone floor running reds like would yeah breakdown leigh anne perrie yeah  jade perrie jade leigh anne leigh anne jesy cause love love love making love baby stuck stuck stuck help help just wanna tonight beep beep yeah baby pump pump pump cause give jump jump jump make start baby help help just wanna tonight beep beep  perrie looky here love love love need baby want baby stuck stuck stuck gotta baby help help help need lovin,2016-11-18,Between Us,2016,275
Nothing Else Matters,jade sometimes take goin deep matter deal babe know lose world start creep nobody words speaking  perrie leigh anne only birds bees know little high little cause come come baby baby much enough things love cause come come baby when comin around  jesy cause nothing else matters like nothing else matters like love wanna fight tonight cause nothing else matters like nothing else matters like love gotta believe leaves then coming back around post  jesy really care nothing else nothing else matters yeah yeah nothing else  jesy told down know never want want start  leigh anne lock gave look still come come baby comin around  jesy cause nothing else matters like nothing else matters like love wanna fight tonight cause nothing else matters like nothing else matters like love gotta believe leaves then coming back around post  jade jesy really care nothing else care nothing else nothing else matters yeah yeah nothing else yeah nothing else bridge jade leigh anne want want nobody else myself falling down boys never give baby down love deep body team babe right want told nothing else matters said  jade jesy cause nothing else matters like nothing else matters like love yeah wanna fight tonight cause nothing else matters like nothing else matters like nothing else matters like love gotta believe leaves then coming back around  perrie jade leigh anne really care nothing else nothing else nothing else matters else matters yeah nothing else yeah nothing else really care woah nothing else nothing else matters yeah yeah yeah yeah nothing else nothing else yeah yeah,2016-11-11,Between Us,2016,270
If I Get My Way,jade night wanna talk tonight really wanna hurt cause face your heart breakin heart breakin night wanna hear name tonight wanna play games cause really wanna take take home  perrie shoulder want shoulder every every night fine fine mine lean want dream every every night fine fine fine  jade leigh anne take care take place night prove take place  jesy this time make this night never letting tonight waitin waitin  leigh anne leigh anne perrie shoulder want shoulder every every night fine fine mine lean want dream every every night fine fine fine  jade leigh anne take care take place night prove take place bridge jade know forget night being friends need cause side long girl came nothing tell lies know breakdown leigh anne perrie take care take place night prove take place woah woah  jade leigh anne leigh anne perrie jade take care take place night prove take place take care take place night prove take place,2017-11-24,Between Us,2017,165
Trash,perrie jade leigh anne ever know went last night creepin door like notice keep going back girl make when apologizes keep focus  leigh anne leigh anne jade always workin late what always phone dealin pain yeah gotta beautiful yeah beautiful telling here gonna  jade leigh anne player throw trash trash tell later never call back back girl problem know sell diamonds spend cash cause yeah liar throw trash trash tears ever looking back back pick things throw trash  perrie jade leigh anne learn learn lighter burn dare give comes running first first girl time first first find deserve serve gonna ones coming  leigh anne jade perrie always workin late what always phone yeah dealin pain yeah gotta yeah beautiful yeah beautiful telling here gonna  leigh anne jade player throw trash tell later never call back girl problem know sell diamonds spend cash cause liar throw trash throw trash tears ever looking back never looking back pick things woah throw trash post  jade leigh anne perrie trash throw trash girl trash throw trash girl yeah trash bridge perrie jade leigh anne gonna treat right keeping wasting time yeah need throw away throw away throw away girl telling here gonna  jade leigh anne perrie player throw trash tell later never call back girl girl problem know know sell diamonds spend cash cause yeah liar throw trash throw trash tears ever looking back ever looking back pick things throw trash,2021-11-12,Between Us,2021,245
Weird People,leigh anne jade perrie when little sitting garden wall yeah wall well must bumped head cause dance more yeah fell wall step crowd party side yeah side uptight sucker gonna tell live life yeah living life  gonna weird night said weird night  leigh anne jesy weird people dance floor came cause weird people love what suckers hate cause weird people shaking from basement roof know people people street people like people like weird people weird  jesy jade slick city fellas hanging yeah money benz mean thing yeah nothing yeah well mister tell this little weird free yeah free cause matter wanna yeah wanna  jade jesy gonna weird weird night night said weird night weird people  perrie jesy leigh anne weird people dance floor dance floor came cause weird people yeah love love suckers hate cause weird people shaking woah from basement roof know people people yeah street people like people like people like bridge well there something bout there something bout girl there something bout there something bout girl nothing wrong baby feeling gonna twerk like afraid health  perrie jade jesy gonna weird night yeah said weird weird night gonna weird yeah night said weird night  leigh anne perrie jade weird people dance floor dance floor yeah came cause weird people love yeah suckers hate cause hate weird people shaking shaking from basement roof know people people street people street yeah people like people like people like weird people,2015-11-06,Between Us,2015,247
Change Your Life,leigh anne jade jesy captures reflection throws mirror floor image distorted screaming worth anymore scared things might through does make wanna hide inner  jade criticize untouchable realise  leigh anne perrie jade change change life take gonna stick together know change change life take yeah take gotta become always known become always known  leigh anne perrie jade jesy body starts flicker like nobody wants know name just another soul feelings nobody feel pain they bring down size never heart hold inside  jade criticize untouchable realise  leigh anne perrie jade change change life take take gonna stick together know know change change life take yeah take gotta become always known become always known post  leigh anne jade change change life yeah take change life take change yeah change life take change life take bridge leigh anne jade perrie right show world something never seen wanna hear scream alone woah yeah  perrie jade jesy change change life take take gonna stick together know invincible change change life take change life take gotta become always known become always known,2012-11-16,Between Us,2012,183
Grown,perrie leigh anne hold wait used frenemy back then even notice tryna hold never even spoke makes think know funny tables turn sitting back baby watching burn regrets lesson learned cause think concern  jesy jade about time know ride assume control blew baby years grown  jade grown grown know grown grown know hold missed boat grown  jesy jade your voice dropped thought could handle played tryna holla washed different league trying hard need flattery funny tables turn sitting back baby watching burn regrets lesson learned cause think concern  jesy perrie jade about time know know ride assume control control blew baby years grown  jade grown grown know grown grown know hold missed boat grown bridge jesy perrie jade jesy leigh anne want took long want want grown want yeah shame baby grown woah yeah  leigh anne jade jesy grown grown know grown grown grown know hold woah missed boat grown yeah grown grown know grown grown grown know hold missed boat grown,2015-11-06,Between Us,2015,169
Towers,leigh anne returned learned that wall comes falling down word hurt when friends keep telling doubt feel love face scars replace shock hard hard know  perrie when knock door tell wanna fight baby sure that going fall time  jesy never brought flowers never held darkest hours left late that heart feels nothing nothing towers once made like towers everything could left late heart feels nothing nothing post  jesy  jade shame blame cause owned heart remember feeling high right back start still feel love face tears erase sorry heart sorry heart start again  perrie knock door tell wanna fight cause heard before going back time going back time  jade never brought flowers never held darkest hours left late that heart feels nothing nothing towers once made like towers everything could left late heart feels nothing nothing post  jade nothing bridge leigh anne when close wanna change mind remember like wanna waste time builtup jesy never brought flowers never held darkest hours left late that heart feels nothing nothing  perrie once made like towers everything could left late heart feels nothing nothing yeah post  jade perrie perrie nothing nothing  jesy once built like towers nothing built like towers heart feels nothing,2013-11-08,Between Us,2013,210
Private Show,jesy adrenaline pumping stand close help imagining things clothes  leigh anne touching teasing yeah yeah need reason yeah yeah feeling yeah yeah that soon leaving yeah yeah right yeah yeah hello yeah yeah wait yeah yeah cause that taking home  jesy wait zone said gotta slow turn lights watch private show ticket front high gotta cause private show  jade kisses lips playing games loving little twist hooked taste yeah  perrie touching teasing yeah yeah need reason yeah yeah feeling yeah yeah that soon leavin yeah yeah right yeah yeah hello yeah yeah wait yeah yeah cause that taking home  jesy wait zone said gotta slow turn lights watch private show ticket front high gotta cause private show bridge jesy jade jesy jade perrie under sheets love good want touch then baby yeah permission like yeah cause that taking home home yeah  jade leigh anne perrie wait zone said gotta slow slow turn lights watch private show ticket front high gotta high gotta yeah cause private show,2016-11-18,Between Us,2016,173
Dear Lover,leigh anne seen places many faces look like home tonight crave attention need affection walk silver line  perrie need need love little left give need your need touch baby that askin  jade dear lover incapable savin heart time wanna pretend hero tonight post  jade pretend hero tonight  jesy jade believing there feelin swear wish moment over walk away closer maybe that good enough  jade need need love little left give need your need touch baby that asking  leigh anne jade dear lover incapable saving heart time wanna pretend hero tonight post  jade leigh anne pretend hero tonight  leigh anne jade need need love little left give need your need touch baby that asking dear lover  perrie jade leigh anne dear lover dear lover dear lover incapable saving heart time incapable saving wanna pretend hero tonight tonight  jade jade perrie pretend hero tonight,2017-11-24,Between Us,2017,153
Freak,jesy kisses free  jesy jade leigh anne getting late baby dinner cold tried call answer phone last thing said back tell think there nothing wrong nothing wrong what haircut cologne cologne lipstick shirt make worse lying  perrie watch tone sleeping alone little better along wanna make sorry making fool that insanity better  kisses free sides freak want mother meet that freak freak post  tamed make scream name playing games more kisses free pray never meet freak  jade listen critical want wake animal story straight wait night sure yeah  leigh anne watch tone sleeping alone little better along wanna make sorry making fool fool that insanity better  jade kisses free sides sides freak want mother meet that freak freak post  jesy tamed make scream name playing games more more kisses free free pray never meet freak bridge jesy perrie jade forgive mistakes turn round late know forgive mistakes turn round late there emotions seen nightmare queen ahead live dream come crawlin back  jesy kisses free sides freak want mother meet yeah yeah that freak freak post  jade jesy tamed make scream name make scream name playing games more yeah yeah kisses free pray never meet never meet freak,2016-11-18,Between Us,2016,208
Boy,jesy remember said told never ever hurt again another break make gonna wake  leigh anne jade perrie call look many times down when gonna learn real beautiful word never said saying need  perrie jade leigh anne forget forget know good enough holding back tears eyes wanna fight never seen fighting never realize gone lose forever girl alright forget  jade girl know tone make stop that fight back away that look ringing phone wanna call back leave that nobody time that  leigh anne funny tables turn when left home find real  perrie leigh anne jade leigh anne forget forget know good enough holding back tears eyes wanna fight never seen fighting never realize gone lose forever girl alright forget bridge perrie leigh anne jade jesy worth girl look knows league likes know worth girl know yeah know league likes likes yeah  perrie leigh anne jade jade leigh anne forget forget know good enough yeah holding back tears eyes your eyes wanna fight never seen fighting never seen fighting never realize gone lose forever girl alright forget that  perrie jesy know worth girl know know league likes likes girl alright forget yeah,2013-11-08,Between Us,2013,198
How Ya Doin’?,jesy doin sorry through leave name number back doin sorry through leave name number back  leigh anne jade time think described love hold missin enough long since treated like deserve long long baby gone gone leave message tone  jesy called missed called missed called missed never back gettin tired listenin  doin sorry through leave name number back doin sorry through leave name number back  perrie perrie jade jade wishing things could good time wake make make fool much history comes thing long long baby gone gone leave message tone  jesy jade called missed called missed called missed never back gettin tired listenin  jade doin doin sorry woah leave name number number back back doin sorry yeah yeah yeah leave name number number back back yeah post   jesy jade called missed called missed called missed never back gettin tired listenin  jade doin doin sorry woah leave name number number back yeah doin sorry sorry through leave name number back back  jesy leigh anne jade never back never gonna back never back never gonna back never back never gonna back never back never gonna back never back never gonna back never back never gonna back never back never gonna back never back never never back number dialed changed,2012-11-16,Between Us,2012,217
These Four Walls,jade feel numb staring shower wall begun feeling come water cold tried today lump throat  jesy time lost sense pride called hundred times hear voice fine  jesy come alive want room take under cause help wonder what night goodbye turn lights sleep these four walls  leigh anne seem leave side pillow tears cried goodbye tried smile today then realised there point anyway  perrie time lost sense pride called thousand times hear voice fine  perrie come alive want room take under cause help wonder what night goodbye turn lights sleep these four walls bridge little perrie woah  little perrie jesy come alive come alive want room take under cause help wonder what night goodbye turn lights sleep these four walls,2013-11-08,Between Us,2013,126
OMG,jade leigh anne gosh again  jesy leigh anne even know that need round applause just like cream kitty lining door maybe work beach bring boys shore maybe flirt hurt they learn  jade even know fall like dominoes  jade leigh anne gosh again said broke heart keeps happenin know always fall always fall gosh again said broke heart keeps happenin know always fall always fall post  jade leigh anne  perrie jade them boys getting ambitious they award twenty more plenty fishes still come first maybe superstitious wanna break curse they wanna girl  jade leigh anne even know fall like dominoes  jade leigh anne leigh anne gosh again said broke heart keeps happenin know always fall always fall gosh gosh again said broke heart keeps happenin know always fall always fall post  jade leigh anne bridge jesy leigh anne jade leigh anne gosh think again broke heart keep happening keep happening come crying ringing alarm better  jade leigh anne leigh anne gosh gosh think again said broke heart keeps happenin broke heart keep happenin know come crying always fall know always fall always fall always fall  leigh anne gosh gosh gosh,2015-11-06,Between Us,2015,200
The End,jesy keep breaking boom boom boom boom boom boom messed heart baby boom boom boom boom boom boom boom black blue hook jesy love fair swear boom boom boom boom boom boom that time  jade keep lying lying myself boom boom boom boom boom boom thinking love right boom boom boom boom boom boom boom never will hook jade much bear much bear swear this time swear boom boom boom boom boom boom that time mean baby bridge leigh anne said gonna leave never leavin know really need party done floor walk door through tears cried alone night lost mind sure sure sure want love anymore  perrie boom boom boom missing missing boom boom boom boom boom boom love boom boom used hook perrie love fair swear boom boom boom boom boom boom that time woah  jesy leigh anne jade perrie promise baby this know woah yeah yeah yeah,2015-11-06,Between Us,2015,153
Clued Up,jade yeah yeah listen  jade leigh anne jesy perrie used dress like everybody else wanted blend they told keep dreams told never yeah love different guard opinions tear down wanna drown like bein happy  jade jesy older never over stop affecting world keeps testing getting track every knock back gotta stay stay stay stay  leigh anne stay clued ready love good live clued just make best have cause sometimes beauty sometimes pain sometimes sunshine sometimes rain clued just make best have post  woah woah woah woah clued just make best have  leigh anne jade jesy perrie invisible feel like forgotten even notice yeah work nerves take over feel need control know need learn yeah gotta remember nothing lasts forever happy  perrie leigh anne older never over stop affecting world keeps testing stayin track every knock back gotta stay stay stay stay  leigh anne jade stay clued ready love good live clued just make best have cause sometimes beauty sometimes pain sometimes sunshine sometimes rain clued just make best have post  woah woah woah woah clued just make best have bridge perrie jade leigh anne jade jesy never never lesson never hide never hide present downs heres nows everything face never forgotten cause every single chance blossom downs yeah living right breakdown perrie jesy leigh anne living right yeah three clued  leigh anne jade jade leigh anne clued ready love good live good live clued just make best have cause sometimes beauty beauty sometimes pain pain sometimes sunshine sometimes rain sometimes rain clued ready just make best sing post  perrie leigh anne woah woah clued just make best have  jesy jade beauty sometimes pain sometimes sunshine sometimes rain,2015-11-06,Between Us,2015,289
About the Boy,jade jesy something about something something about something something about something just something  jesy  head words make stutter swag step change grey colour guaranteed found lucky number feeling help make wonder  leigh anne jade jade need right something nobody tell mind takes high stop mine  perrie jade leigh anne good feeling like girl gone running around like lovefool taking down stop come down locked want know playing heart choice there something post  leigh anne perrie jade jesy something about something something about something something about something there something  perrie first time lightning thunder green light kiss pulls under test answer need finally chance  leigh anne jade leigh anne need right something nobody tell mind takes high stop mine  perrie jade leigh anne good feeling like girl gone running around like lovefool taking down stop come down locked want know playing heart choice there something post  leigh anne perrie jade something about something about something about something about something about something there something bridge perrie know like play slow running time like lost self control cause know done poor heart come undone baby please exhale laughter  perrie jade leigh anne jade leigh anne jesy good good feeling like girl gone running around like lovefool taking down stop stop come down locked want want know playing heart know playing heart yeah choice there something post  leigh anne perrie jade perrie jade something about something about there something something about something about there something something about something there something  leigh anne perrie jade jade something about something about something about something about something about something there something,2013-11-08,Between Us,2013,277
I Won’t,jesy perrie pride self respect need nothing more want nothing less cause enough make work cause want love loved  jesy never cause never much fall never cause never much fall  jesy anybody tell take anything granted cause know nothing good comes easy cause post   jade leigh anne jesy heart head high strong survive cause hurt wash away rain learned enough shine  jesy never cause never much fall never cause never much fall  jesy leigh anne jade anybody tell take anything granted cause know nothing good comes easy cause post  leigh anne jade bridge jesy perrie jade leigh anne pinnock hold head hold head daylight hold head hold head cause future looking bright hold head daylight hold head cause future looking bright hold head daylight these stones sticks makes hold head cause future looking bright these stones sticks need hold head daylight these stones sticks makes hold head cause these stones sticks need  jesy anybody tell take anything granted cause know nothing good comes easy cause  perrie jesy head head head head yeah head head head head,2015-11-06,Between Us,2015,186
