title,lyrics,release_date,release_year,Word Count
What I Am,contributorstranslationsdeutschespa ewhat lyrics  drinking absinthe math adding enough running round board game know name give  crazy foolish stupid playin games  told loved would fucked told flyin would looked take sayin just take cause stayin feet sand  readin shit make sense conspiracy save livin moment feels good till hurts need somebody  crazy foolish stupid playin games  told loved would fucked told they flyin would looked take sayin just cause stayin feet sand bridge take tired dancin around point sharp jagged like shape glass steals voice  told loved would fucked told flyin would looked looked take sayin just take cause stayin feet sand  told loved would fucked told flyin would looked take sayin just take cause stayin feet sand,2024-03-15,2024,125
Imprint,contributorsimprint lyricsconveying undying love need person imprint song zayn sophomore album icarus falls this song person focus life  read more  leave imprint cause minute cause minute live where stay wanna stay late  girl still make planets faded away might think crazy know baby anyway  girl took minutes life yeah told need want back want back want back want back  take cause love cost excuses cursed something want change  girl still make planets faded away might think crazy know baby anyway  girl took minutes life yeah told need want back want back want back want back  never told story they building victorian times guess story just tellin mine change scenario jumpin like mario gotta give lose life  girl took minutes life yeah told need want back want back want back want back girl took minutes life yeah told need want back want back want back want back,2018-12-14,2018,155
Satisfaction,contributorssatisfaction lyricsin satisfaction zayn acknowledges insatiability mourns life circumstances hinder happiness music video song released january fourth official music read more  nobody said would easy nobody said would hard nobody gave rulebook follow soul hollow gotta find place satisfaction alone  cause satisfaction  zone space life always zone space life always  nobody said would leave nobody says dark somebody told tomorrow soul hollow gotta find place satisfaction alone  cause satisfaction  zone space life always zone space life always bridge best pull away something surges urges stay cause satisfaction  zone space life always zone space life always  gotta find place satisfaction alone satisfaction alone,2018-12-14,2018,110
Scripted,contributorsscripted lyrics  blurry screens fuzzy broken scenes finding words flow blurry screens fuzzy broken scenes hold close finding love  hearts feel same names like change time  wanna what scripted whether know need cause wanna what scripted whether know need  hearts feel same names like change time  wanna what scripted whether know need cause wanna what scripted whether know need bridge still remember eyes even black flashed light eyes second time night feels right  wanna what scripted whether know need cause wanna what scripted whether know need,2018-12-14,2018,92
​tRuTh,contributors truth lyricsin truth zayn sings journey boyband singer solo artist well known fact malik felt oppressed still direction tells complex magazine that read more  luck game find through know many times this scene dream yours course caught game know names blame  point fingers life take time time truth questions life take time time truth  truth truth truth truth truth truth truth truth  mind front seat view know many times talk through dreams scenes enemies caught game again  point fingers life take time time truth  truth truth truth truth truth truth truth truth bridge tried hide hide hide hide  point fingers life take time time truth  truth truth truth truth truth truth truth truth,2016-03-25,2016,122
If I Got You,contributorsif lyricssurviving foreign world finding someone gets song zayn sophomore album icarus falls this song features sound often present music read more  think space soul fell down found earth leaving know face think fell place  anywhere anywhere anywhere anywhere round universe there there wherever wherever babe  think space soul fell down found earth leaving know face think fell place baby baby baby  care care wherever been cause floating night feels like dancing feeling feeling falling love cause know before babe  think space soul fell down found earth leaving know face think fell place baby baby baby baby baby think space soul fell down found earth leaving know face think fell place baby baby baby baby baby,2018-12-14,2018,121
Stand Still,contributorsstand still lyrics  skies blue birds yellow flowers growing bloom million chances glances catching eyes across room  time stands still move this world filled somehow move  rain could pour upon face beauty would still shine would live thousand lifetimes sent find  time stands still move this world filled somehow move bridge move water babe lift rocks tide getting stuck nothing stop move water babe lift rocks tide getting stuck nothing stop  time stands still move this world filled somehow time stands still time stands still move move this world filled somehow some move,2018-12-14,2018,98
Talk To Me,contributorstalk lyrics  look through hair face things through games ways fooled  know seen face different times places  come little closer wanna know keeping secrets there sheets tonight talk deeper already know need keeping secrets wanna leave lights talk talk talk talk talk talk talk talk talk  peace words come mouth wanna hear something divine planets align  know seen face different times places  come little closer wanna know keeping secrets there sheets tonight talk deeper already know need keeping secrets wanna leave lights talk talk bridge baby head love forever here where together  come little closer wanna know keeping secrets there sheets tonight talk deeper already know need keeping secrets wanna leave lights talk talk talk talk talk talk talk yeah talk talk talk yeah  talk,2018-12-14,2018,133
Natural,contributorstranslationst ezayn natural traducci espa natural lyrics natural second song zayn sophomore album icarus falls slow burning lust feeling song this song zayn lover feeling place naturally read more  like breathin speakin when touch like force nature feelin believe birth love like force nature  undeniable love unforgettable love nothing compares when feel skin  feels natural natural when come together like force nature feels natural natural when come together like force nature post  when come together together together when come together together together  pure heart deeper beautiful like bluest ocean like wave broke down barriers like bluest ocean  incredible love unforgettable love nothing compares when feel skin  feels natural natural when come together like force nature feels natural natural when come together like force nature post  when come together together together when come together together together bridge like hurricane love like hurricane love like hurricane when come together like hurricane love like hurricane love like hurricane when come together  feels natural natural when come together like force nature feels natural natural when come together like force nature post  come together come together right right come together come together right right come together together right,2018-12-14,2018,203
MiNd Of MiNdd (Intro),contributorstranslationsespa olmind mindd  lyrics mind mindd  first heard days release mind mine behind scenes video zayn complex cover shoot  edge find inside mind mine open what inside mind open what inside mind,2016-03-25,2016,35
Alienated,contributorstranslationsespa olalienated lyrics  people same stand beside enough away last night drinking tried think away pain made mistake tried disconnect body from soul soul feel alright already  intoxicated need answer right wrongs home know place  feeling alienated spaceship alone goodbye past leave laugh cause always right along  know reasons pain brought front know again call beer gains know years that feelings change  intoxicated need answer right wrongs home know place  feeling alienated spaceship alone goodbye past leave laugh cause always right along  winds make noise change wings skin help away cause always raining clouds always grey away  yeah feeling alienated spaceship alone goodbye past leave laugh cause always right along  along goodbye past goodbye,2024-04-12,2024,123
BRIGHT,contributorstranslationsespa olbright lyrics  found life shots getting high cage fell away asked dance again yeah found life first kiss last goodbye dust settled down crowd  loving colour white surrounding colored eyes though kryptonite stays crib tonight light like dynamite load like gigabyte turn fucking lights wanna bright  wanna bright wanna bright wanna bright wanna  love mind love bass likes getting high yeah different night knows free flash dirt shoes know  loving colour white surrounding colored eyes though kryptonite stays crib tonight light like dynamite load like gigabyte turn fucking lights wanna bright  wanna bright wanna bright wanna bright wanna bright bridge found life shots getting high cage fell away asked dance again yeah  wanna bright wanna bright wanna bright wanna bright wanna bright wanna bright wanna bright wanna,2016-03-25,2016,135
Stardust,contributorstranslationsespa olstardust lyrics  pretty christmas cardboard wait outside pick there somethin different touch different love different love  feels like stardust floatin around shootin right across black feels like stardust fallin around funny found maybe maybe yeah yeah yeah yeah  found perfume magazine places moonlit scene love love there baby cause make anywhere  feel like stardust floatin around shootin right across black feels like stardust fallin around funny found maybe maybe yeah yeah yeah yeah  break  feels like stardust floatin around shootin right across black feels like stardust fallin around funny found maybe maybe maybe,2024-05-17,2024,100
Icarus Interlude,contributorsicarus interlude lyrics icarus falls last track first physical disc icarus interlude functions turning point album songs shift away uncomplicated affection love read more   call icarus guess flew close myth call legend yves saint laurent bees coming honey supply surprise lifetime lifetime right place right time right time  girl love better anyone girl love better known girl love better known before better known before post  better known before stopping know before what know  stopping feel plays mind every time real every night feel that mind  lying liars lying lying liars lying liars lying liars every night lying cause flying lying liars lying liars,2018-12-14,2018,109
GOLDEN,contributorsgolden lyrics golden song zayn debut solo album mind mine song final track target exclusive edition album definition soulful piano backed ballad zayn uses vivid read more  goes golden like sands time hope hope still fine know bright look light meant know bright look light meant every single jigsaw piece seems incomplete  choices make change path take know that somewhere there path chose there life share there love grows  goes golden like sands time hope hope still fine know bright look light meant every single jigsaw piece  choices make change path take know that somewhere there path chose there life share there love grows bridge cause grows grows hope know cause grows grows know bright look light  choices make change path take know that somewhere there path chose there life share there love grows,2016-03-25,2016,139
Good Guy,contributorsgood lyricssampling melody bang bang baby shot down nancy sinatra good zayn expresses intentions girl stating this interestingly contrasts read more  fall girl right kind keep side just cause know feels right  explain every story boring girl thing dropping from purpose present future president pleasure meet hope feel presence cause making feature working instinct like extinct creature hands lockin slide bleacher street lamps like trying teach  seen scene before real life nature wrote score lines look eyes  good good know mine bang know mine bang bang good good know mine bang know mine bang bang,2018-12-14,2018,99
You Wish You Knew,contributorsyou wish knew lyrics  girl problem unless trust could best friend could girl problem unless trust love  wanna love wanna make headline lose wanna choose cause that wish knew wish knew wish knew wish knew wish knew wanna choose cause that wish knew  sayin thing when mean that holding onto nothing holding back cause girl problem unless trust yeah girl problem trust love  wanna love wanna make headline lose wanna choose cause that wish knew wish knew wish knew wish knew wish knew wanna choose cause that wish knew bridge hear speak desperately talking shit trying like know like that know like that  wanna love wanna make headline lose wanna choose cause that wish knew wish knew wish knew wish knew wish knew wanna choose cause that wish knew,2018-12-14,2018,134
No Type (Remix),contributorsno type remix lyricszayn malik shocks direction fans releasing cover famously self contradictory song  righteous drink lucas  zayn type bitches thing like life cups yeah every night check price make money spend like livin life mama tell yeah livin right post  zayn righteous mama tell yeah yeah mama tell yeah mama tell yeah yeah mama tell yeah drink lucas  righteous alright bonnie rotten left cotton right gotta tell fuck know what wrong know what right pick politician hang throw party after watch police arrive comply wild beast life legally blind blind laws rules society pulls wool eyes confined floors walls normal ball female replies emails type nails seen tell waste time cleanest need snapchat prove life gives fuck dress there death palestine pretty gold blue black white proves dependent reflection light your perception becomes deception mind that judge colour creed size drink lucas fuck girl cause type fuck every girl cause type hype shit when still pedal pedal bike never slow down never sell mine alight tell ever said will ever understand happens state mind damn newcomer fuckin girl well know plan fuck whole world whole world zayn payin whole hotel wholesale like only check price till though yolo trill though little dildo what deal though album comin deal though will fuck girl pill  zayn righteous type bitches thing like life cups yeah every night check price make money spend like livin life mama tell yeah livin right post  zayn mama tell yeah yeah mama tell yeah mama tell yeah yeah mama tell yeah,2015-06-15,2015,260
All That,contributorsall that lyrics  when woke morning dawned first last time care feels right stopping night things fall apart part feel distant reactions instant emotions constant instance conscience would take time weigh options  that that give that that that that that give that that that stay morning take back back back here want give that that that  never cross mind have crossed lines find find think inside immortalized mortalized life coming sides attack mind like optimus prime prime kick skip finish line this minute mine  that that give that that that give that that that give that that that stay morning take back back back here want give that that that that that give that that that give that that that give that that that stay morning take back back back here want give that that,2018-12-14,2018,139
"Me, Myself and I",contributorsme myself lyrics  ladies feel help sing  believe believed everything would last young naive think past silly dream kids love blind feels right wrong  believe fell schemes smarter that dumb naive believe that changed foolish compete when cheat loose women took time moved because realized  myself that that found need took gonna best friend myself that that found need took gonna best friend  controlling said that love your family told would next thing know dealing with problems love blind feels right wrong  over stop calling come pick clothes need front like still girlfriends know even best friend tried warn took time strong because realized  myself that that found need took gonna best friend myself that that found need took gonna best friend bridge myself know never disappoint myself must cried thousand times ladies feel help sing regret time spent yeah hurt learned along vowed make through after rain come again break whoo whoo  myself that that found need took gonna best friend myself that that found need took gonna best friend,2018-06-29,2018,179
My Woman,contributorstranslationsespa olmy woman lyrics  love partly leave tonight fall pieces might just mind roll tonight  since stone stoned livin lonely then came along made believe made believe leave finished wastin time livin blurred like lines  fill forget known this mise demise what holdin grabbed hold took control mind  love partly leave tonight fall pieces might just mind roll tonight  where wanna where stay last night save mind save time yeah know holdin somethin long eyes yeah blind blind  fill forget known this demise  love partly leave tonight fall pieces might just mind roll tonight love partly leave tonight fall pieces might just mind roll tonight  just tonight,2024-05-17,2024,115
Fresh Air,contributorsfresh lyrics  could changed wanted could make doves wanted tell want that tell want that  sorry never sober start drinking much thinking every time  think need fresh fresh fresh feeling pressure pressure pressure wanna talk bout bout even started know tryna pressure post  differences differences differences different shit differences differences differences different shit  caught cycle pardon psycho could right though guess that life there nothing  think need fresh fresh fresh feeling pressure pressure pressure wanna talk bout bout even started know tryna pressure think need fresh fresh fresh feeling pressure pressure pressure wanna talk bout bout even started know tryna pressure post  differences differences differences different shit differences differences differences different shit different shit  could changed wanted could make doves wanted tell want that tell want that differences,2018-12-14,2018,136
