title,lyrics,release_date,release_year,Word Count
​lUcOzAdE,contributorstranslationsespa lucozade lyrics   sippin pink lucozade blazin found haze seeing blacks greys hoping basket sways left right talk shit night does make right smoke maybe seeing shit seeing pain inside house fear  even wanna know things hear quick headlights shine bright fuckin deer wishing ambition position fishing long movie wrong breathe pollution solution making shit confusin  winnin losin about path choosin time heals pain promotes self soothin when scars gone bruising wanna take watches chains gold rings gettin caught feelings bring lack sanity losing touch reality smoking much starting clarity travelin still lookin  bulls emotions splattered pattern even begin spot shit never happened lies eyes nothing truth leave mouth tryna fuckin scream words come tryna fuckin scream words come  older told meant takes three anyway hope leaving soon started elephant room disguised perfume smell consumes takes mind search world never find everything done there need pace need stamina shit girl probably woulda kept runnin outwit cause cunnin that outfit cause stunnin begging cause losing mage feeling type explain fuck goin think wrong when told,2016-03-25,2016,180
​rEaR vIeW,contributorstranslationsespa rear view lyrics rear view picks album back intermission midtempo guitar electronics churn lament zayn titled song rear view song reminisces people thoughts read more  heart mine search cause time help find words melodies memories stories sound absurd tell lies  long look eyes wherever follow behind  heard things done wars heard love lost began heard miles gone just start again heard through sounds like need friend friend  please wait coming home tonight wanna love  long look eyes wherever follow behind behind  heard things done wars heard love lost began heard miles gone just start heard through sounds like need friend friend bridge never doubted myself doubted tired looking myself rear view  heard things done wars heard love lost began heard miles gone just start heard through sounds like need friend friend,2016-03-25,2016,139
​sHe,contributorstranslationsespa lyricszayn described party tune that intense lyrically cuts with cool slightly detached tempo vibe romantic theme fits right rest read more  puts spirit nightcap always knows crowd puts mouth round cigarette cause likes that always dance rainin when startin baby looks like waitin makin time slow show table  bright lights fadin feels right crazy bright lights fadin feels right crazy  wants somebody love hold wants somebody love right wants somebody love kiss wants somebody love right  cryin loves holdin hands leave cause baby wanna lonely says want hold  bright lights fadin feels right crazy bright lights fadin feels right crazy  wants somebody love hold wants somebody love right wants somebody love kiss wants somebody love right post  right right bridge right right right right yeah right right right right right right right right right right right right  wants somebody love hold wants somebody love right right wants somebody love hold wants somebody love right wants somebody love kiss wants somebody love right,2016-03-25,2016,171
INTERMISSION: fLoWer,contributorstranslationsespa olintermission flower lyrics intermission flower urdu translation combines pakistani folk sound urdu lyrics this song marks zayn first song released urdu father native language york times read more urdu urdu phonetic mohabbat phool khilay dill sukoon miley mujhe mujhe mujhe english translation until flower love blossomed this heart peace give heart give heart give heart,2016-03-25,2016,56
TiO,contributorstranslationsespa oltio lyrics  taste mouth leave freak like work somethin believin like cheatin  wanna watch take take makeup baby take wanna watch take take clothes watch take take post  take take baby take take take take baby take  push wall take easy like hard like need naked explore inner secrets  want watch take take makeup baby take wanna watch take take clothes watch take post  take take baby take take take take baby take take take baby take take take baby take baby take bridge wait wait turned mine wait turned  wanna watch take take makeup baby take wanna watch take take take clothes watch take wanna watch take wanna take makeup baby take just take baby wanna watch take take take clothes watch take,2016-03-25,2016,132
Unfuckwitable,contributorstranslationst eespa olportugu snorskdeutschunfuckwitable lyrics  unfuckwithable world that shoulder cold unfuckwithable  tired fake friends fake love know time show found higher need inspired vibe life design your sentiment irrelevant cause again cause time life  unfuckwithable world that shoulder cold unfuckwithable bridge nobody take home yeah worth weight gold forget whatever told unfuckwithable unfuckwithable  they said wouldn shit shit thinkin always cool when never even mind happens time probably thought turn water wine water wine happens time  unfuckwithable world that shoulder cold unfuckwithable,2021-01-15,2021,87
Rainberry,contributorsrainberry lyricszayn questions rainberry asking significant other presumably then girlfriend gigi hadid cheating although zayn hasn specified term rainberry means could read more  rainberry please think knees worry know know even start truth break heart worry already know  many bones inside closet thought buried deep never minute peace sleep  rainberry falling blood lips eyes heavy somebody else missed tell what going said rainberry somebody else somebody else  eyes cause work time already dried mine drown yours wash hands change past those stories shit mean sure  many bones inside closet thought buried deep never minute peace sleep  rainberry falling blood lips eyes heavy somebody else missed tell what going said rainberry somebody else somebody else bridge rainberry please rainberry rainberry please  many bones inside closet thought buried deep never minute peace sleep  rainberry falling blood lips eyes heavy somebody else missed tell what going said rainberry somebody else somebody else,2018-11-30,2018,157
River Road,contributorstranslationst eespa olportugu snorskitalianodeutschriver road lyrics river road eleventh final track zayn third studio album nobody listening track describes sadness relationship hoping more also questions read more  define other stand pillar pillow fairly other call lover drinks liver cried river full tears post  ever hope something else ever hope something else  breeze outside window turned color know again leaves turned tint orange answers inside myself  what leave behind where choose truth tired falling when floating closer  control outcomes reins ride rhythm doubled vision fairly feeling searchin meaning still believe stopped ceiling years post  lightly floating ecstasy ever hope something else  breeze outside window turned color know again leaves turned tint orange answers inside myself  what leave behind where choose tell truth tired falling when floating closer  define other stand pillar pillow call lover drinks liver cried river full tears post  ever hope something else,2021-01-15,2021,154
Love Like This,contributorstranslations deutschlove like this lyrics love like this zayn return music scene releasing original material since album nobody listening duet ingrid michaelson begin again dropped read more  love show show when show back ever roll roll roll name black clothes stare hips hair like that zone zone zone zone like  wanna waste time wanna waste time cause crown wanna take time everything line would rather dead gonna mean life that lived without baby  guess that love like this usually never wanna jump like this think wanna dump chips cause cannot back guess that faith like this give everything skate like think gotta take risk cause cannot back  lovin what line never make back make back make back chase fine doesn matter left right your direction mind zone zone zone zone like  wanna waste time wanna waste time cause crown wanna take time everything line would rather dead gonna mean life that lived without baby  guess that love like this usually never wanna jump like this think wanna dump chips cause cannot back guess that faith like this give everything skate like think gotta take risk cause cannot back post  kiss wrapped four jack know that cannot back kiss wrapped attached know that cannot back bridge wanna waste time crown everything line would rather dead gonna mean life lived without baby  guess that love like this usually never wanna jump like this think wanna dump chips cause cannot back guess that faith like this give everything skate like this think gotta take risk cause cannot back  baby cannot back think gotta take risk cause cannot back,2023-07-21,2023,274
Common,contributorstranslationsportugu scommon lyricscommon fourth song zayn second studio album icarus falls relays message void previous insecurity person loves filled feels connection person unlike other read more  always lookin behind fences always felt isolated know defensive find refrain damned this somethin real somethin right never love never felt  need chest warm time take away breath written lips nothin common bout ordinary world nothin enough everything gray mistakin love lust when hold arms nothin common bout  there nothin common bout there nothin common bout  flaws imperfections that makes love more spiritual connection know fuckin beautiful refrain damned this somethin real somethin right never love never felt  need chest warm time take away breath written lips nothin common bout ordinary world nothin enough everything gray mistakin love lust when hold arms nothin common bout  there nothin common bout there nothin common bout bridge wanna feel love just give trust common cause common enough  ordinary world nothin enough everything gray mistakin love lust when hold arms nothin common bout  there nothin common bout there nothin common bout there nothin common bout there nothin common bout,2018-12-14,2018,189
BoRdErSz,contributorsbordersz lyrics  border border border border  life party border stick knife body border border somethin always wanted border good cause doin good border border  wind blows care just like ocean change they know know long hold like commotion  take break walls right wanna wanna cool cross lines lost right wanna post  right border border give this give border border fallin need proof border border  beautiful insanity border border like movie change scene border border taste sweet profanity border border good cause think doin good border border  they know know long hold like commotion  take break walls right wanna wanna cool cross lines lost right wanna post  right border give this give fallin need proof right border bridge give this give fallin need proof border give this give border border fallin need proof border  take break walls right wanna wanna cool cross lines lost right wanna post  right border give this give border border fallin need proof border right border give this give border border fallin need proof border right border,2016-03-25,2016,181
Windowsill,contributorstranslationst eespa olportugu snorskdeutschwindowsill lyrics  zayn fuckin countertop window floor mind swear type roll flow fuckin countertops elevated could blind give anything want never know come back more  zayn done cause right here waitin right time call back  zayn cigarett fuckin windowsill yeah gettin here only thing wanna know away cigarettes fuckin windowsill break glass show really feel deep that show love  zayn lookin like lookin soul stoppin maybe could somethin want flow fuckin countertops elevated could blind give anything want never know come back more  zayn done cause right here waitin right time call back  zayn cigarettes fuckin windowsill yeah tell gettin here only thing wanna know away cigarettes fuckin windowsill break glass show really feel deep that show love  devlin your cigarettes windowsill left night before take never light night comes want more play dumb rain comes pour want fake love just real freak board waitin impatient station when body curse damnation salvation girl could walk hell sure tempt satan devil herself  zayn devlin cigarettes fuckin windowsill yeah tell gettin here only thing wanna know away away cigarettes fuckin windowsill break glass show really feel show deep that show love away,2021-01-15,2021,201
Sour Diesel,contributorssour diesel lyrics sour diesel single zayn second studio album icarus falls song involves zayn comparing woman marijuana strand sour diesel zayn first teased song later read more  walks place hands waist thigh shooter game before murdered gain promised kill again  know takin like rocket spaceship high stop like sour diesel stop feelin stop feet feels like dreamin didn feel seep burn burn burn  like sour diesel burn burn burn like sour diesel burn burn burn stop feelin burn burn burn stop feet like sour diesel burn burn burn burn burn burn like sour diesel  lips face back place legs dirty again smokin more space touches there again  know takin like rocket spaceship high stop  like sour diesel burn burn burn like sour diesel burn burn burn stop feelin burn burn burn stop feet like sour diesel burn burn burn burn burn burn like sour diesel burn burn burn feels like heat yeah when flame burn burn burn stop heat yeah stop feet burn burn burn like sour diesel stop feelin burn burn burn stop bridge cause burnin around glad found cause burnin around glad found yeah yeah yeah yeah  like sour diesel burn burn burn like sour diesel burn burn burn like sour diesel burn burn burn like sour diesel like sour diesel burn burn burn yeah burn burn burn burn burn stop feelin burn burn burn yeah sour diesel burn burn burn like sour diesel burn burn burn burn burn burn burn burn,2018-07-18,2018,252
No Candle No Light,contributorsno candle light lyricsdiverging zayn series slow burning jams candle light introduces electronic inspired sound british singer featuring rapper nicki minaj stranger read more  nicki minaj young money  nicki minaj zayn hand hand chest chest tangled feeling less know love free make believe sell dreams morning light gotta gotta gotta face fire fire longer blazin  zayn nicki minaj woke wrong side even know left handle love handle lies friend zone love quit burning time woke wrong side  zayn nicki minaj candle light candle light candle light  zayn nicki minaj baby losing really fooling this agree disagree things meant wanted morning light gotta gotta gotta face fire fire longer blazin  zayn nicki minaj woke wrong side even know left handle love handle lies friend zone love quit burning time woke wrong side  zayn nicki minaj candle light candle light candle light bridge zayn nicki minaj gotta gotta gotta face fire fire longer blazin  zayn nicki minaj candle light candle light candle light  nicki minaj switch lane switch lane watch gyal switch lane this here nicki zayn zayn seen,2018-11-15,2018,186
Back To Life,contributorsback life lyricsin back life zayn expresses gratitude admiration towards love role plays helping battle anxiety this zayn first time speaking anxiety common read more   what changed mind what said over flying long remember like sober what lost lives what said game over what forget lines lose composure  honestly that watching gives oxygen gets hard breathe wrong right always side lose fight  know bring back bring back bring back life bring back bring back bring back life  what never what never cause burning long world keeps getting colder  honestly that watching gives oxygen gets hard breathe wrong right always side lose fight  know bring back bring back bring back life bring back bring back bring back life bridge nobody like around world seen girls places seen faces nobody like  honestly that watching gives oxygen gets hard breathe wrong right always side lose fight know bring back life,2018-12-14,2018,155
I Won’t Mind*,contributorsi mind lyrics mind demo recorded zayn malik failed make direction album four with timing release coming less week announced departure read more  cause watchin right start know mind even though know never mine  look around cause love blind darlin right feelin proud without doubt feel  cause watchin right start know yeah know mind even though know never mine mind even though know never mine  messed around until found thing said could never ever died allowed talk gotta tell  cause watchin right start know yeah know mind even though know never mine mind even though know never mine,2015-03-30,2015,103
Insomnia,contributorstranslationsespa einsomnia lyricsin tireless cycle insomnia song zayn sophomore album icarus falls song describes endless wondering hoping partner left return verses read more  roaming strolling streets burning eyes slept weeks testing torment future bleak lost moment with words speak  find peace find peace  fool waiting what never come back what never come back there nothing made another made another tune what never know hearts deceive night calls dreamers  sleep stolen searching thieves these memories head vivid  find peace find peace close eyes feel again find peace  fool waiting what never come back what never come back there nothing made another made another tune what never know hearts deceive night calls dreamers bridge insomnia close eyes feel again insomnia close eyes feel again  fool waiting what never come back what never come back there nothing made another made another tune what never know hearts deceive night calls dreamers,2018-12-14,2018,154
Flight Of The Stars,contributorsflight stars lyrics  armageddon girl there goodbyes follow hold close standing edge tomorrow still deep rush still follow  feeling high touch body that feel soul inside body believe eyes swear glow follow close fingertips touch want body fingertips touch want  want ever wanted front right front what done never done this could  armageddon girl there goodbyes follow hold close standing edge tomorrow still deep rush still follow  feeling like deserve somebody burn bright blind somebody following flights stars cars home  want ever wanted front right front what done never done this could  armageddon girl there goodbyes follow hold close standing edge tomorrow still deep rush still follow bridge long feeling same follow flames long feeling same follow flames  armageddon girl there goodbyes follow hold close standing edge tomorrow still deep rush still follow,2018-12-14,2018,141
Connexion,contributorstranslationsespa olportugu snorskdeutschconnexion lyrics  funny come mind that that feel little closer just started thinkin like force explain work like magnet babe thought next moment givin feelin  could suspicion maybe overthinkin thinkin like come picture when start feel like something missin missin  wanna miss another love gonna dive right head first unknown unknown unknown like know like know baby could keep wanna stop words nough feels like drug really fuck post  call digital physical conn ction yeah yeah call digital physical connection  love every single night that feel love that take clothes stay bedroom cause always brain away leavin next mornin give feelin  could suspicion maybe overthinkin thinkin like come picture when start feel like something missin missin  wanna miss another love gonna dive right head first unknown unknown unknown like know like know baby could keep wanna stop words enough feels like drug drug drug really fuck post  call digital physical connection yeah yeah call digital physical connection,2021-01-15,2021,167
SHE DON’T LOVE ME,contributorsshe love lyrics love semi tragic story unrequited love although zayn would prefer relationship girl doesn truly love they still same read more  need question time asking know  kinda hard walk right when walking left with high heels sexy dress talking phone phone wish could seen gone love  think know love that fuck right think know love that fuck right post  want body want body mine  want question time asking know  kinda hard walk right when walking left with high heels sexy dress talking phone phone wish could seen gone love  think know love that fuck right think know love that fuck right post  want body want body mine bridge should wait morning loud eyes escape feeling your body mine  think know love that fuck right think know love that fuck right post  want body want body mine,2016-03-25,2016,148
BLUE,contributorstranslationsespa olblue lyricsinterpolating acapella version prelude bach prelude major unaccompanied cello beautiful meditative blue mind mine first bonus track album most read more  clouds angels sing eyes wanna smile knows need loving knows need touching plays heart emotion give love devotion gives thoughts notion need body needs need somebody love blue bridge wrong long said wrong long wrong long  clouds angels sing smile yeah eyes wanna knows need loving knows need touching plays heart emotion give love devotion gave thought notion need body needs  need somebody love love blue love blue love blue love blue,2016-03-25,2016,98
Tonight,contributorstranslationst ezayn tonight traducci espa tonight lyrics  just talk know sayin give that girl know stayin where goin feel space mine said goin every space time  love tonight speak mind take time know mine know mine  love like tomorrow like there time love love like tomorrow never gonna come love like tomorrow like there time love love like tomorrow never gonna come  tell always different mornin last night side space time wanna fall eyes there point stallin there nothin hide right priceless things protection keeps alive right right  love tonight speak mind take time know mine know mine  love like tomorrow like there time love love like tomorrow never gonna come bridge matter when feelin yourself know thinkin  love tonight speak mind take time know mine know mine  love like tomorrow like there time love love like tomorrow never gonna come love like tomorrow like like tomorrow like there time love love like tomorrow never gonna come,2018-12-14,2018,165
PILLOWTALK (Remix),contributorstranslationspolskipillowtalk remix lyricsfor remix smash pillowtalk former directioner zayn enlists wayne rapper well known songs chart success resulting product might inspired read more  wayne zayn yeah paradise yeah zone  zayn wayne climb board mula baby slow high tempo yeah light dark hold hard mellow  zayn wayne seeing pain seeing pleasure nobody body body bodies together love hold close tonight always love wake next  zayn wayne piss neighbors tunechi baby place feels tears place lose fears yeah reckless behavior come place pure dirty yeah fucking fighting paradise zone paradise zone paradise zone  wayne zayn pillow talk fuckin fightin fuckin fightin yeah fuck love like husband wifey makin through bedroom fuss fuck truce yeah somethin there nothin ugly cute love proof never chucking deuce never comin unloose tongue noose thumb boose make jump roof touchin moon love spoon when cummin through  zayn wayne piss neighbours yeah place feels tears place lose fears tunechi yeah reckless behavior yeah mula baby place pure dirty yeah fucking fighting yeah paradise zone paradise paradise zone  zayn wayne anybody knows that game goes weeks somebody many seeds gotta grow conceive goal felt seed more fuck times cause bored yeah standin halls great shine they dreams reason mind woulda held back woulda told would told woulda stayed night probably know right there stuff comes next hahaha interlude wayne paradise zone paradise zone  zayn wayne piss neighbours place feels tears place lose fears yeah reckless behavior tunechi baby place pure dirty yeah fucking fighting paradise zone paradise zone yeah paradise zone,2016-02-25,2016,260
When Love’s Around,contributorstranslationsespa olportugu snorskdeutschwhen love around lyrics when love around first feature album nobody listening emerging star american singer signed columbia records delivers smooth vocals goes flawlessly read more  ever love ever really loved someone people tend rush people tend love only takes woman show means love love  zayn missin tonight yeah yeah yeah yeah wishin right here cause love around cause love around  zayn yeah never feels right never feel type need life yeah could real only takes woman show means love love  zayn zayn missin tonight yeah yeah yeah yeah wishin right here cause love around cause love around cause love around cause love around bridge zayn keep mornin could aura givin fallin keep mornin could aura givin fallin  zayn cause love around cause love around cause love around cause love around cause love around,2021-01-15,2021,141
I Don’t Mind,contributorsi mind lyricsin mind zayn resigned idea falling most likely heights fame success achieved early music career back earth become grounded flying read more  mind falling means again like dream trying fight against mind wishing dancing dark again light blows wanna spend time issue never grow  when with with with when never comes when with with with when find lost girl never running fuck anybody else there  know back side mind tell lies mind tell night when when know know playing mind mind tell lies mind tell night when mind  mind waiting need time love again want nothing just little something pain mind wishing dancing dark again light blows wanna spend time issue never grow  when with with with when never comes when with with with when find lost girl never running fuck anybody else there  know back side mind tell lies mind tell night when when know know playing mind mind tell lies mind tell night when mind bridge really mind love been waiting sign night really mind love girl know  know back side mind tell lies mind tell night when when know know playing mind mind tell lies mind tell night when mind,2018-12-14,2018,202
