title,lyrics,release_date,release_year,Word Count
Dusk Till Dawn,contributorstranslationst eespa olportugu deutschitalianodusk till dawn lyricson dusk till dawn zayn enlists song tell story lovers willing whatever takes stay together song released standalone single september read more  zayn tryna indie tryna cool just tryna this tell feel wind feel through windows inside room refrain zayn cause wanna touch baby wanna feel wanna rise sins just  zayn light make love tonight make fall love baby right here  zayn never alone dusk till dawn dusk till dawn baby right here hold things wrong dusk till dawn dusk till dawn baby right here post  zayn dusk till dawn baby right here  zayn shut like jacket would roll rapids find wave fits feel wind feel through windows inside room refrain zayn cause wanna touch baby wanna feel wanna rise sins just  zayn light make love tonight make fall love baby right here  zayn never alone dusk till dawn dusk till dawn baby right here hold things wrong dusk till dawn dusk till dawn baby right here bridge zayn zayn girl give love body stop girl give love body stop girl give love body stop girl give love body girl give love body  zayn never alone dusk till dawn dusk till dawn baby right here hold things wrong dusk till dawn dusk till dawn baby right here post  zayn dusk till dawn baby right,2017-09-08,2017,229
PILLOWTALK,contributorstranslationsportugu espa olpolskideutschpillowtalk lyricsthe debut solo release former direction zayn malik pillowtalk gets dirty malik explained sunday times everybody something people want hear read more  climb board slow high tempo light dark hold hard mellow  seeing pain seeing pleasure nobody body body bodies together love hold close tonight always love wake next love hold close tonight always love wake next  piss neighbours place feels tears place lose fears yeah reckless behaviour place pure dirty fuckin fightin paradise zone paradise zone  pillow talk enemy ally prisoners then free thin line  seeing pain seeing pleasure nobody body body bodies together love hold close tonight always love wake next  piss neighbours place feels tears place lose fears yeah reckless behaviour place pure dirty fuckin fightin paradise zone paradise zone bridge paradise paradise paradise paradise zone zone zone zone paradise paradise paradise paradise zone zone zone zone  piss neighbours place feels tears place lose fears yeah reckless behaviour place pure dirty fuckin fightin paradise yeah zone paradise zone,2016-01-29,2016,171
I Don’t Wanna Live Forever,contributorstranslationsespa olportugu sfran aisdeutschpolskii wanna live forever lyrics wanna live forever sultry feeling like life hopeless without lover written fifty shades grey sequel fifty shades darker song performed duet between read more  zayn been sittin eyes wide open behind four walls hopin call cruel existence like point hopin  zayn baby baby feel crazy night night every give somethin nothin what happening  zayn wanna live forever cause know living vain wanna wherever wanna keep calling name until come back home wanna keep calling name until come back home wanna keep calling name until come back home  taylor swift sittin eyes wide open thing stuck mind wonderin dodged bullet lost love life  taylor swift baby baby feel crazy night night every gave somethin gave nothin what happening  zayn taylor swift both wanna live forever cause know living vain wanna babe wherever wherever wanna keep calling name until come back home wanna keep calling name until come back home wanna keep calling name until come back home bridge taylor swift zayn both looking nicest places baby baby feel crazy around empty faces night night every looking nicest places give somethin nothin tell place what happening  zayn taylor swift both wanna live forever cause know living vain wanna wanna babe wherever wherever wanna keep calling name until come back home home wanna keep calling name until come back home back woah wanna keep calling name until come back home wanna post  both zayn wanna keep calling name until come back home back home baby wanna keep calling name until come back home  taylor swift zayn wanna keep callin name until come back home until come back home,2016-12-09,2016,282
Let Me,contributorslet lyrics zayn first solo single third since debut album mind mine following partynextdoor assisted track still time dusk till dawn featuring apart from read more  sweet baby meaning meaning know time stay morning stay morning duvet days vanilla cream vanilla cream more night together exclusively exclusively  baby love love then take care  rest life rest yours rest life rest yours rest ours  drinkin finest label finest label dirty dancing table table long walks beach april beach april yeah promise darling faithful faithful  baby love love then take care love  rest life rest yours rest life rest yours rest ours bridge give body love like come little closer things this feelin last forever baby that truth love  baby love love then take care love  rest life rest life rest rest yours rest life rest life rest rest yours rest rest ours,2018-04-12,2018,149
Entertainer,contributorstranslationsportugu russian eespa olentertainer lyrics entertainer zayn malik second single following soothy track released back april year whose music video currently million views read more  thought when lied face could truth every step knew fooled  guess didn know that favorite entertainer watch laugh would fuck take fool game rules favorite entertainer watch laugh would fake take fool show thing  never coming turn down when need most turn when need most turn down never coming turn down when need most turn when need most turn down  thought smarter ashamed knew right away stopped lovin happened touch wasn enough  thought know that favorite entertainer watch laugh would fuck play fool game rules favorite entertainer watch laugh would fake play fool show thing  never coming turn down when need most turn when need most turn down never coming turn down when need most turn when need most turn down bridge know harder take face playing games face straight know fake love anyway turn need anyway anyway anyway  never coming turn down when need most turn when need most turn down never coming turn down when need most turn when need most turn down  know need most most time,2018-05-23,2018,203
​iT’s YoU,contributorstranslationsespa lyrics strays sound direction leaning towards influenced production malay best known work frank ocean channel orange second release read more  reasons talking give fuck need  tell brain equate tell lies face   cover scars bleed silence silence mistaken peace  wrong wantin make tell lies face  bridge could lesson never learn looked like blessing curse know know ,2016-02-25,2016,63
Better,contributorstranslationst eespa olportugu snorskdeutschnederlandsbetter lyricszayn returns music scene better first release lead single third studio album nobody listening although done collaborations read more  hope leave good vibes living room floor hurts asked more your probably loves ever cause finally yeah finally knocked down  cause sometimes better gotta heart break cause love yeah baby love just time hear tryna know might feel quite love tell love  wait fight give goodbye right save tears eyes making wait hate save love  fell falling fall floor gamble take gamble take take still mind sometimes must admit like crime trial acquitted meant fitted like glove hated admit  cause obviously back would ruin that deep rearranged wanna names fruit sayin things take back deep rearranged feel same  wait fight give goodbye right save tears eyes watching wait hate save love,2020-09-25,2020,140
Still Got Time,contributorsstill time lyrics still time song singer songwriter zayn featuring partynextdoor supposed lead single zayn second studio album icarus falls later replaced dusk till read more  zayn just stop lookin love girl young still time girl young still time girl young still just stop lookin love still time girl young still time girl young still time  zayn this could something something scare away turning somethings nothing babe already used games babe play role play same  zayn come give yeah yeah come give play play could tell bored cause young still time waste time wasting away yeah matter yeah that smile take places know wanna faces  zayn partynextdoor just stop lookin love girl young still time girl young still time girl young still just stop lookin love still time girl young still time girl young still time look  partynextdoor know working magic know diggin fabric boyfriend material said yourself digging lying said equally equally babe feeling feel something real owly well truthfully gotta stop looking  partynextdoor come give yeah yeah come give play play could tell bored cause young still time waste time wasting away yeah matter yeah that smile take places know wanna places  zayn just stop lookin love girl young still time girl young still time girl young still just stop lookin love still time girl young still time girl young still time bridge zayn partynextdoor this could something yeah this could this could something something could something yeah this could this could something yeah something right wanna  zayn partynextdoor come give yeah yeah come give play play could tell bored cause young still time waste time wasting away yeah matter yeah that smile take places know wanna places  zayn just stop lookin love girl young still time girl young still time girl young still just stop lookin love still time girl young still time girl young still,2017-03-24,2017,318
Tightrope,contributorstranslationst eespa olportugu snorskdeutschtightrope lyricszayn sings fully committing relationship tightrope shares story relationship model gigi hadid also mother daughter khai first read more  gotta feel like walkin tightrope wanna fall cause already eyes closed never fell love tall  ready cause ready never thought ready again guess there somethin bout neon glow thinkin bout givin  somethin told somethin told somethin told somethin told  sittin legs across torso alone baby ready minute might fall lately feel like grip gone  ready cause ready never thought ready again guess there somethin bout neon glow thinkin bout givin  somethin told somethin told somethin told somethin told post   somethin told somethin told somethin told somethin told somethin told somethin told somethin told somethin told post ,2021-01-15,2021,128
A Whole New World (End Title),contributorsa whole world title lyrics whole world comes soundtrack remake aladdin disney collaboration zayn american singer zhavia ward song cover original read more  zayn show world shining shimmering splendid tell princess last heart decide open eyes take wonder wonder over sideways magic carpet ride  zayn zhavia whole world fantastic point view tell dreaming whole world dazzling place never knew here crystal clear that whole world whole world  zhavia unbelievable sights indescribable feeling soaring tumbling freewheeling through endless diamond  zhavia zayn both whole world dare close eyes hundred thousand things hold breath gets better like shooting star come back used whole world horizons pursue chase anywhere there time spare share whole world  bridge  zhavia zayn both whole world whole world fantastic point view tell dreaming whole world every turn surprise with horizons pursue every moment letter chase anywhere there time spare anywhere there time spare share whole world  zhavia zayn both whole world whole world that that thrilling chase wondrous place,2019-05-09,2019,167
Fingers,contributorstranslationsespa olfingers lyricsa slow burning ballad zayn second solo album fingers failed love paralyzing zayn preventing even texting lost love song stands stark contrast read more  fucked want looked loved stuck need hopin touch wanna feel much conceal hiding features sliding filters should that middle hiding thinkin  fucked want even text cause fingers working heart wanna know then come love come love come love come love come love come love come love come love  what tell typo said loved didn mean sayin playin confused tryna play smooth stood spinnin room state consumed state consumed  cause fucked want even text cause fingers working heart wanna know then come love come love come love come love come love come love come love come love bridge know taking strength keep restrained cause different things replacing feelings felt seen yourself where shame shame need  fucked want even text cause fingers working heart wanna know then come love come love come love come love come love come love come love come love,2018-10-18,2018,172
​wRoNg,contributors wrong lyricszayn teams singer kehlani wrong kehlani sole featured artist mind mine this first collaboration zayn kehlani throughout track zayn kehlani sing read more  zayn place show light feels right take flight clothes cause soft this fair fight wanna shed light subject wetter ever four letters never question likes messy like undressing  zayn looking wrong place love think real looking wrong place love stop cause like  kehlani kehlani zayn here cause right vibe seems like probably dope mind gotta right time good night time demeanor baby pleaser treat teacher cause problem problems know good tonight never thought understood baby people meant loved others make take willing give love hate  both zayn kehlani looking wrong place love think real looking wrong place love stop cause like refrain zayn kehlani stop doin doin stop doin stop bridge zayn kehlani really know what doin really care stop maybe keep stop doin stories wanna share stop  both zayn kehlani looking wrong place love think real looking wrong place love love stop cause like looking wrong place love think real looking wrong place love love stop cause like,2016-03-25,2016,189
Vibez,contributorstranslationsnorskt eespa olsrpski russian portugu japanese italianodeutschvibez lyrics vibez marks zayn first release serving second final single third studio album nobody listening released exactly week song song read more  keep waitin waitin night closer already know know vibes know vibes movin fast slow baby mediocre know vibes know vibes  room imaginin things could tell lies lies need here need here mind runnin wild touchin slow just word ready anticipation plays four need  baby right will when touch tell feel feel trust make feel surreal baby mind mine things type things happen dreams right need just keep  keep waitin waitin night closer already know know vibes know vibes movin fast could slow fast baby mediocre vibes vibes bridge movin fast fast  baby right will when touch tell feel feel trust make feel surreal baby mind mine things type things happen dreams right need just keep keep waitin  keep waitin waitin night closer yeah already know know vibes know vibes vibes movin fast could slow baby mediocre vibes vibes,2021-01-08,2021,173
Calamity,contributorstranslationspolskiespa olportugu snorskdeutschfran aiscalamity lyrics calamity first song zayn raps song album hear bradford accent clearly contrary previous songs nobody sure this read more  nostalgia funny feelin feel depleted feelings revealin goin willing when time wrap white linen this sanity whatever calamity myself fuck fantasies snake fell ladder prefer speakin analogies enough trust family know what next brain dead never miss brain lives cannabis resist dark abyss leave mark start exist mind prism shape like prison state ther right feel late there light view stake life choose take what left room space there rumours face prefer sooner late seen actors bafta straight mean barrel hear sing carol they tryna sprint long farah they tryna long gone bother there other thought shudders lovers wanna still sleep death cousin weeks four dozen years pass press rewind just watch life lock right ties  nobody nobody listenin nobody nobody listenin nobody nobody listenin nobody nobody listenin,2021-01-15,2021,154
Good Years,contributorstranslationst eportugu sgood years lyrics good years zayn second release announcing second album icarus falls track details anxieties living life spotlight regrets time spent there this read more  rather anywhere anywhere here rather anywhere anywhere here close eyes crowd thousand tears pray waste good years good years good years  voices screaming loud hell care bout else nothing world could bring down high among stars without worry neither wants sorry  rather anywhere anywhere here rather anywhere anywhere here close eyes crowd thousand tears pray waste good years good years good years  much drugs alcohol what hell fighting cause whole damn world know that numb dumb change story neither wants sorry  rather anywhere anywhere here rather anywhere anywhere here close eyes crowd thousand tears pray waste good years good years good years bridge need chance breathe feel alive meets night show light feel wind fire hold pain deep inside eyes eyes  rather anywhere anywhere here rather anywhere anywhere here close eyes crowd thousand tears pray waste good years good years good years  pray waste good years good years good years,2018-12-06,2018,185
BeFoUr,contributorsbefour lyrics befour third promotional single zayn first solo album mind mine released march song previewed behind scenes video fader cover story november read more  done before like this  drink drunk feel right funk there somethin want take right wrongs gonna stay zone tired pickin bone bothered fight more  numb roof fire just give proof livin wire numb roof fire just give proof livin wire  wanna wanna wanna gotta wanna want shame face post  done before like this like this  time move many hours gone heart beats pump blood strings pull tongue cheek pardon speak tune chords into song  numb roof fire just give proof livin wire  wanna wanna wanna gotta wanna wanna want shame face post  done before like this like this bridge flashing lights  wanna wanna wanna gotta wanna want yeah shame face wanna wanna wanna wanna gotta wanna want shame face post  done never done like this baby like like this like like this baby done never done like this baby like like this like like this this,2016-03-25,2016,182
​fOoL fOr YoU,contributorstranslationsespa fool lyricsone album quietest songs gavin hayes characterised piano driven fool unexpectedly beatles esque ballad comparing life zayn said classic read more  this love tainted need hate caught dream movie scene know mean  when dark turns mist resist  cause fool things fool things things things things  when lookin like this resist know sometimes hide time cause gonna defeat believe believe  cause fool things fool things things bridge know know given chance again cause help myself cause stop myself love bein fool  cause fool things fool things things  this love tainted,2016-03-25,2016,98
​dRuNk,contributorstranslationsespa drunk lyrics drunk first previewed clip zayn twitter february point song title assumed late nights track producer makeyouknowlove later posted song title read more  late nights eyes amnesia late nights eyes amnesia need  right straight intoxicated true buzzin feel laced coming different phase  another like supposed take back take shot wasted every night gone every song faded every night dancin night long  drunk summer yeah yeah drunk summer yeah yeah drunk summer yeah yeah yeah drinkin flowin rollin falling down post  late nights eyes amnesia need  right emotional lose control hope said much guess always push luck  another like supposed take back take shot wasted every night gone every song faded every night dancin night long fakin night long  drunk summer yeah yeah drunk summer yeah yeah love drunk summer yeah yeah yeah woah drinkin flowin rollin falling post  late nights eyes eyes amnesia late nights baby eyes amnesia need need baby  drunk drunk drunk drunk drunk drunk drunk drunk drinks drunk drunk drunk drunk drunk drunk drunk drunk drunk summer drunk summer goin around yeah,2016-03-25,2016,187
Outside,contributorstranslationst eespa olportugu snorskdeutschoutside lyrics outside serves third track zayn third studio album nobody listening this calm guitar tune solely produced charlie handsome zayn reflects breakup partner read more  yeah yeah yeah yeah yeah yeah yeah  wrongs make right when left least tried back tonight yeah decide  leave life outside leave life outside leave life outside  know always head things must said hurts think someone else bein know innocent love real hope hurts think refrain shirt wearing that favorite first time touched could save  wrongs make right when left least tried back tonight yeah decide  leave life outside leave life outside leave life outside  things through snuck parents just roof much yeah starin perfect view keep want when look think refrain shirt wearing that favorite damn really thought would make yeah  wrongs make right when left least tried least tried yeah back tonight back decide  leave shit outside leave shit outside leave life outside,2021-01-15,2021,163
There You Are,contributorstranslations there lyrics there zayn third promotional release announcing second studio album icarus falls song released zane lowe beats world record three days official album read more  only know know only forgive when sorry  need broken when fixed need well sick friends rely come through they like river  falling losing myself hear calling  there there open arms there there  whispers background behind closed doors mess without more little drunk that went yeah sober when floor  falling losing myself hear calling  there there open arms there there post  only know know only forgive sorry even messed there bridge need cold need young when  there there open arms there there post  only know know only forgive sorry even messed there  need need need need when caught crowds when clouds when caught crowds when clouds there,2018-12-11,2018,144
Sweat,contributorstranslationst eespa olportugu snorskitalianodeutschsweat lyrics  stayin night losing track time reaching higher heights only thing mind only thing mind  touch like give attention dive ocean love show much want  drippin body like gold slowly steamin windows skin skin again sweat sweat love tear clothes slowly steamin windows skin skin again sweat sweat  damn could lost heartbeat damn body take baby love baby  touch like give attention dive ocean love show much want  drippin body like gold slowly steamin windows skin skin again sweat sweat bridge could lost heartbeat lost body take eyes baby love baby  drippin body like gold slowly steamin windows skin skin again sweat sweat love tear clothes slowly steamin windows skin skin again sweat sweat,2021-01-15,2021,125
LIKE I WOULD,contributorstranslationsportugu sespa ollike would lyricsthe third song released zayn debut solo album mind mine like would upbeat dancefloor ready song bonus track appear deluxe version album read more  what while talking bout style thought what lighting cold hearted cold hearted know late wired face inspired guess good cold hearted cold hearted  probably gonna sound wrong promise last long never back thought like know that  touch like love like would know body right love like would love like would  okay want cause want been thinkin over through stop wasting time messing mind cold hearted cold hearted  probably gonna sound wrong promise last long never back thought like know that  touch like love like would know body right love like would love like would like would touch like love like would know body right love like would love like would like would bridge love like would love like could know body know body  touch like love like would know body right love like would love like would like would touch like would touch like love like love like would know body right love like would love like would like would,2016-03-10,2016,195
Too Much,contributorstoo much lyricsmarking primary collaboration zayn connected legendary producer rapper timbaland sultry almost futuristic ballad notable combined synths drum beats remind read more  zayn think time flies took digits back think fucked flashback leave mind kinda sidetracked felt good feel think know take back there nothin  timbaland must addiction wanted expect fall must affliction wanted call call keepin night keepin night must addiction there nothin  zayn timbaland guess want much much want love lust love enough yeah that need touch that need touch yeah that need touch that need touch yeah that need touch wiki  zayn never meant though gotta keep then again fuck know always mind felt good feel think know take back there nothin  timbaland must addiction wanted expect fall must affliction wanted call call keepin night keepin night must addiction there nothin  zayn timbaland guess want much much want love lust love enough yeah that need touch that need touch yeah that need touch that need touch yeah that need touch wiki bridge zayn when room becomes game play white lines seem turn snakes guess turn white lies face know know place nothin nothin nothin  zayn timbaland guess want much much want love lust love enough yeah that need touch that need touch yeah that need touch that need touch yeah that need touch wiki,2018-08-02,2018,225
