artist,title,genre,lyrics,Album,release_year,Word Count,score,sentiment,filter,joy,sadness,surprise,trust,anger,disgust,anticipation,fear
Lauren Jauregui,Falling,R&B,look screen look back check clock again late even know responsibilities bigger wait outside door wanna keep surviving better earn more know always hide fight cause human wanna live without tired barely stand fact stand catch fallin catch fallin down catch fallin down again pace around circles leave heartache door gotta think future while past creeps everything know stay wher start lead heart least grow wanna better gotta better know know know always hide fight because human human wanna live without without tired barely stand fact stand catch fallin catch fallin down catch fallin down again bridge focus blessings lessons focus blessings lessons focus blessings lessons lessons blessings lessons focus blessings lessons catch catch fallin catch fallin down down catch fallin down again again again catch fallin nowhere catch fallin down mother catch fallin down,Prelude,2021,145,0.64,surprise,intenso,0.11,1.0,1.0,1.0,1.0,0.0,1.0,1.0
Lauren Jauregui,Sorry,R&B,already years feel trust like should ever prove never enough understood hard future could insecurity seein leave want back take back fight like knew would cycle there salvaging growing apart separate ways sorry love keep hurting although miss keep going around circles know falling apart sorry love anymore wanna break really wanna fake anymore tired blame game babe already tried feeling babe feeling babe listen version loving there salvaging growing apart separate ways sorry love like wanted keep hurting keep hurting although miss keep going around circles know falling apart sorry love anymore sorry love keep hurting keep falling apart although miss,Prelude,2021,114,-0.61,sadness,intenso,0.15,1.0,1.0,1.0,0.15,1.0,1.0,1.0
Lauren Jauregui,Scattered,R&B,scattered like leaves upon wind seasons must begin change again shattered pointed shards heart broken left patterns carpet wept tear stained face face these demons alone like night stay light they talk write thunder lightening gloves match makes head think might need help feel like myself feel like myself think might need help feel like myself feel like myself scattered like leaves upon wind seasons must begin change again shattered pointed shards heart broken left pieces carpet bled bloodstained hands around hidden blades faced society with sinister grins carve wins from what left sanity gloves gloves match match makes last makes head think might need help feel like myself feel like myself think might need help feel like myself feel like myself mensa clothing scattered single bedroom apartment drink splattered look like paint jackson pollock grey matter havin seein regardless myself world girl says trust issues honestly fuck need guts fuck open open cuts disgusting discussed caught emotions like usher confess caught dreams nightmares demons fight fair wakin weepin night terrors actin light skinned really dreamin cryin need zion right here comin eyes write tears woah think might need help feel like myself feel like feel like myself feel like anymore think might need help feel like myself feel like,Prelude,2021,238,-0.61,fear,intenso,0.0,1.0,0.0,1.0,1.0,0.95,0.0,0.33
Lauren Jauregui,Temporary,R&B,some days confidence comes like cure sometimes noise loud ignore energy fake make smile know waste time feel insecure prayer remind more than they saying projecting caught feel there much heal feelings temporary anyway they telling things found hard would probably away embrace temporary anyway anyway stays good long mmmm learn learn temporary anyway anyway find learn learn think know tuve abrir ojos tres inhalar profundamente contar hasta diez exhalar para quitar este peso estr cuando entran dudas hacen hacen olvidar poder siempre sonr porque temporary anyway anyway never stays good long never stays good long learn learn temporary anyway anyway find learn learn think know just,Single,2021,121,0.55,joy,intenso,1.0,1.0,1.0,1.0,1.0,1.0,1.0,1.0
Lauren Jauregui,Em(oceans),R&B,wear heart sleeve seems everyone meet thinks take piece leave find hard believe know doin shit empathy empathy empathy empathy wanna wanna free from weight carry wanna wanna free emotions waves emotions motions drown ocean emotions feeling broken even notice emotion post feel much feel much feel much feel much know feel feel much feel much know feel much feel much feel much feel much know push away make does anyone else feel same feels like going insane guess shit empathy empathy empathy empathy wanna wanna free from weight carry wanna wanna free emotions emotions waves emotions emotions motions drown ocean emotions feeling broken even notice even noticing emotion emotion post feel much cause feel much feel much feel much feel much feel much feel much much feel much much,In Between,2023,145,-1.0,sadness,intenso,0.6,1.0,0.9,0.75,1.0,0.9,0.6,1.0
Lauren Jauregui,Wolves,R&B,runnin wolves made alright searchin purpose learnin really time mine alive runnin wolves night dolla dolla there comes time every life gotta handle shit depend friends tight squeeze everybody problems gotta live matter tough face face fears momma shed tears wolves lost streets turned victim daugher left behind pictures life decisions should stay mission lost many system only ways dead prison dolla know there gotta better runnin wolves tryna away know there gotta better runnin wolves tryna away runnin wolves made alright searchin purpose learnin really time mine alive runnin wolves night night russ russ clock tickin plot stop bitchin fake stars bout stop wishin distance existence every time talks listen conquerin feel myself guess destiny really road time back forth movin crucial proud younger tellin knew knew atlanta still money like vanderbilt millionaire hamster wheels hopin real anythin right plan build anybody tryna shake bitch standin still russ russ scraped scratches wounds tryna reach people bout tour soon might need therapist maybe support group went dorm rooms courtrooms board rooms runnin wolves made alright searchin purpose learning really time time mine alive runnin wolves night night runnin runnin keep runnin runnin runnin keep fire eyes keep runnin runnin keep runnin runnin runnin keep headin runnin runnin keep runnin runnin runnin keep fire eyes runnin runnin keep runnin runnin runnin keep headin runnin,In Between,2023,266,1.0,anticipation,intenso,0.96,1.0,1.0,1.0,0.13,1.0,0.3,0.96
Lauren Jauregui,All In My Feelings,R&B,gonna gram though even answer text wasn even tryna obsess wanted used gettin head wonderin wonderin upset want feel felt help tryin help trust like turn feelings fuck feelin type feeling anyway anyway usually away away this even like feelings frustrated usually away away promise even like feelings listen this must past shit waitin round answer whenever upper hand always mine sippin mescal even drink know still called upset upset want feel felt seem help seem help lord please afraid afraid could mean lost control want mean anythin anyway usually away away this even like feelings feelings frustrated frustrated usually away away promise even like feelings bridge wanna wanna feelings wanna wanna feelings anyway anyway anyway usually away away away this even like feelings feelings frustrated frustrated usually away away away promise even like feelings feelings feelings feelings like wall keep fallin keep fallin keep walls keep fallin fallin like wall keep fallin keep fallin keep wall keep fallin fallin answers texts writing song fuck dude,In Between,2023,180,-0.67,anger,intenso,1.0,1.0,1.0,1.0,1.0,0.73,1.0,1.0
Lauren Jauregui,The One,R&B,really wanna more better sure step door right what fuck cryin been times know fightin anymore hands wanna fight excited wanna frequency inside hide show love need money keep love want better attention amor keep money doin fine gotta insecure know better adore slow down really more every time speak take startin right trust fight just ride love surrender promise like baby show love need money keep love want better attention amor keep money doin fine break bridge come show love need little just soul love come show love come show need little just soul love show love need money keep love love want better attention amor keep money doin fine,In Between,2023,160,0.82,joy,intenso,0.28,0.64,0.1,0.2,1.0,0.0,1.0,0.1
Lauren Jauregui,In Between,R&B,love between full meant future been dreams come tell path lies ahead things must leave behind instead dead parts finally reached dead always seems through live alive learn survive thrive life open pieces buried deepest inside pieces still find place hide lungs hearts stung long become accustomed numb hung potential instead truth monumental accidental truth detrimental allow allow used wade waters between until born again renewed meet meet between love love between,In Between,2023,76,1.0,joy,intenso,1.0,0.95,1.0,1.0,0.0,1.0,1.0,1.0
Ally Brooke,Low Key,Reggaeton,really know really know know things could show really know looking body closely there things know could take fast take slowly could ibiza cozy friends looking they know cause left slipped back really know really know know things could show really know forget phones morning morning post gets story take places then rest guess self explanatory friends looking they know cause left slipped back really know know really know know things could show really know post tyga watchin plottin neck freeze body known givin spend invent wave invent baguettes wrist actin timid take mexico nobody business throw that dunk slam looking love minute serve plate come love like litty really know really know know know things could show really know really know post,Single,2019,173,-0.86,trust,intenso,1.0,0.76,1.0,1.0,0.76,0.0,0.0,1.0
Ally Brooke,Lips Don’t Lie,Reggaeton,boogie hoodie hope lips fighter fire make fall love minute leaver believe told commitment real really close know feel baby know know supposed boogie hoodie mine mine tell lips when kiss right back right back tell lips post lips lips tell lips quick quick slow slow drive past limit difficult know know make come fast minute dance least drunk know real baby know know supposed boogie hoodie mine mine tell lips when kiss right back right back tell lips post lips lips lips lips tell lips lips tell lips boogie hoodie treated like friend feel comfortable treated like told secrets secrets show fine though wanna make business business tell lies though found heart cold left down like around hard control though left solo boogie hoodie mine mine tell lips when kiss right back right back tell lips post lips lips lips lips tell lips lips tell lips,Single,2019,184,-0.7,joy,intenso,0.33,0.66,1.0,1.0,0.0,0.0,1.0,0.1
Ally Brooke,No Good,Reggaeton,good need nobody need that good kiss goodbye dead night could start ride dark should fireworks second call name name name name name hell quit heaven sake make promise leaving heart wants wants madness feeling hung hanging woah good need nobody need that good good need nobody need that good poison together perfectly your venomous eyes could blink time keep attached make promise leaving heart wants wants madness feeling hung hanging good need nobody need that good good need nobody need that good post good good good good good good good good that good good good good good good good good good that good bridge promise leaving heart wants wants madness feeling hung hanging woah good need nobody need that good good need nobody need that good good good good good good good good good that good good good good good good good good good that good,Single,2019,163,1.0,joy,intenso,1.0,1.0,0.2,1.0,1.0,1.0,1.0,1.0
Ally Brooke,Higher,Pop,wind singing symphony sweetest sound ever heard feels amazing lifting free here high bird moment need wait going know love stay already cause love taking higher higher higher look higher higher higher know getting close hear choir cause love taking higher higher higher there notion gratitude inside waves wash clean soul clean soul could stay forever quite happily these dreams made gold thank everyone ever prayed gave wings gave wings know love stay already cause love taking higher higher higher look higher higher higher know getting close hear choir cause love taking higher higher higher bridge gone gone when play song when play song from bird view from bird view look look cause love taking higher higher higher look higher higher higher higher know getting close hear choir cause love taking taking higher higher higher higher higher higher higher,Single,2019,147,-1.0,joy,intenso,0.69,0.0,0.0,1.0,0.0,0.0,0.86,0.0
Ally Brooke,500 Veces,Reggaeton,messiah messiah tell tell baby feel certain around tried many times hide really gotta know unrequited messiah wanna give with feels different been patient gotta know melo mami tengo confesarte like touchin body like quiere bese night quinientas veces tengo confesarte like touchin body like quiere bese night quinientas veces messiah mamacita angles loco loco left five hundred comments photo photo obvious friends tryna bent benz kissing pretty lips possess whatever like simon says tambi siento algo especial pero nunca pude demostrar tengo mero atenci pero solo falta coraz mami siempre tuve tentaci besarte probar messiah wanna give feels different patient gotta know know messiah tengo confesarte like touchin body like quiere bese night quinientas veces tengo confesarte like touchin body like quiere bese night quinientas veces same same messiah fuera guitarra toco hasta same same same quiera enam rame fuera campana sueno cama same same same quiera enam rame messiah wanna give feels different patient gotta know melo mami messiah tengo confesarte like touchin body like quiere bese night quinientas veces tengo confesarte like touchin body like quiere bese night quinientas veces same same,Single,2020,215,-0.88,anticipation,intenso,1.0,1.0,0.0,1.0,0.0,0.0,0.26,1.0
Ally Brooke,Fabulous,Pop,nobody perfect flaws gorgeous gorgeous keeps calling cause worth keep check make earn past heart someone else hands everybody tell understand that gonna love someone gonna love self already know fabulous need else else gonna love curves curves gonna love scars scars ever gonna break heart woke feelin fabulous sister sister sister whoa wait fabulous sister sister sister whoa woke feelin fabulous sister sister sister whoa wait fabulous sister sister sister whoa know purpose talk notice notice they what surface what underneath make nervous past heart someone else hands else hands everybody tell understand that gonna love someone gonna love self already know fabulous need else else gonna love curves love curves gonna love scars love scars ever gonna break heart break heart woke feelin fabulous sister sister sister whoa woke feelin fabulous sister sister sister whoa woke feelin fabulous sister sister sister whoa wait fabulous sister sister sister whoa woke feelin fabulous fabulous fabulous sister sister sister whoa wait fabulous wait sister sister sister whoa woke feelin fabulous sister sister sister whoa wait fabulous sister sister sister whoa,Single,2020,192,-0.66,joy,intenso,0.5,0.0,1.0,1.0,0.0,0.0,0.3,1.0
Ally Brooke,Cake,Pop,nothin distortion head hearing fading said believe believe cause words dead when breathe speak goes other what different things wanna hear even believe true want cake post want cake woah woah cake cake woah woah cake share world anymore time knock someone else door find store next door even care ride bike take hike want here goes other what different things wanna hear even believe true want cake post want cake please woah woah cake cake please woah woah cake bridge think time quit made decision done cake what girl find love goes other what different things wanna hear even believe true want cake post want cake woah woah cake cake woah woah cake,Single,2011,122,-0.86,joy,intenso,1.0,1.0,0.0,1.0,1.0,0.0,1.0,1.0
Ally Brooke,The Truth Is In There,Pop,undeniable that beautiful physical skin deep cause magical find mirror gotta look little deeper look inside look inside inside cause truth there cause truth there what need cause truth there cause truth there cause truth there unbelievable strong anywhere limit dreams unreachable take doubt kick door lock know sometimes know power here look inside look inside inside cause truth there cause truth there what need cause truth there cause truth there cause truth there bridge reach just believe anything look inside look inside inside cause truth there cause truth there what need cause truth there cause truth there truth truth cause truth there cause truth,Single,2018,112,-0.7,trust,intenso,0.76,1.0,1.0,0.73,1.0,0.0,1.0,1.0
Ally Brooke,What Are We Waiting For?,Pop,plans show leave came nowhere with possibilities turnin nothing into somethin like going feel feel coming baby woah close wonder losin self control what waitin dancin close hold wanna leave alone what waitin post keepin distracted keep mind ease middle madness focusin turnin nothing somethin like going like feel feel coming baby woah close wonder losin self control what waitin dancin close hold wanna leave alone what waitin post what waiting bridge know close losing self control hold tight hold tight know close losing self control hold tight what waiting close wonder losin self control what waitin dancin close hold wanna leave alone what waitin what waiting,Single,2020,118,-1.0,sadness,intenso,0.76,1.0,1.0,1.0,1.0,0.0,0.76,1.0
Ally Brooke,Mi Música,Reggaeton,letra sica verso como explicarte contigo nada hace falta pesar tormenta estampar coro tengo hace falta nada pero hace falta nada tengo hace falta nada tengo hace falta nada pero hace falta nada tengo hace falta nada verso presa tiempo mundo quiero estar siempre despertar junto coro puedo tener mansiones tener ambiciones esto nada tengo puedo tener millones intenciones estar coro tengo hace falta nada pero hace falta nada tengo hace falta nada tengo hace falta nada pero hace falta nada tengo hace falta nada solo guitarra coro porque puedo tener mansiones tener ambiciones esto nada tengo puedo tener millones intenciones estar coro tengo hace falta nada pero hace falta nada tengo hace falta nada nada como explicarte contigo nada hace falta pesar tormenta estampar,Single,2021,127,-0.91,joy,neutro,0.0,0.0,0.0,0.0,0.0,0.0,0.0,0.0
Ally Brooke,Tequila,Reggaeton,letra tequila verso cans esperar calor calor todo nada decido quiero llores busques mandes flores coro mente olvida bebiendo tequila cans monoton mente olvida bebiendo tequila cans monoton verso solo quiero sean doce salir bailar toda noche bebiendo conoces contigo hacer poses coro quiero solo causas alegr ahora conoc salgo noche llego como antes quiero solo causas alegr ahora conoc salgo noche llego como antes coro mente olvida bebiendo tequila cans monoton mente olvida bebiendo tequila cans monoton puente baby tengo funda costeo confundas vivos calle muerto tumba siempre lista rumba coro quiero solo causas alegr ahora conoc salgo noche llego como antes quiero solo solo causas alegr ahora conoc salgo noche llego como antes coro mente olvida bebiendo tequila cans monoton mente olvida bebiendo tequila cans monoton mente olvida bebiendo tequila,Single,2022,137,-0.91,joy,neutro,1.0,0.0,0.0,0.0,0.0,0.0,0.0,0.0
Ally Brooke,Last Christmas,Pop,merry christmas last christmas gave heart next gave away this year save tears give someone special once bitten twice keep distance still catch tell baby recognize well year surprise merry christmas wrapped sent with note saying love meant know fool been kissed know fool again last christmas gave heart next gave away this year save tears give someone special crowded room friends tired eyes hiding soul thought someone rely guess shoulder face lover fire heart girl undercover tore apart found real love never fool again last christmas christmas gave heart heart next gave away gave away this year save tears give someone special last christmas last christmas gave heart next gave away gave away this year save tears save tears give someone special special,Single,2018,131,-0.64,joy,intenso,1.0,0.0,0.78,1.0,0.0,0.78,0.52,0.78
Ally Brooke,Por Ti,Reggaeton,letra verso pudiese protegerte tropiece aunque cosas mereces pero coraz pertenece aunque peleemo vece aunque veces enga aunque veces parezca extra vida entera acompa lagrimas coro todo todo todo verso levanto eres ritmo canto eres ritmo eres perfecto encantos dios cuide santo manto vida contigo tiene sentido prisi coraz estas recluido fueras materia hubiera ejercido negativo nunca consumido coro oscuridad fuiste todo llegaste llegaste limpiar alma toda calma coro todo todo todo puente todo todo limpiar alma toda calma todo todo limpiar alma toda calma verso pudiese protegerte tropieces aunque cosas mereces pero coraz pertenece aunque peleemo vece aunque veces enga aunque veces parezca extra vida entera acompa lagrimas,Single,2022,110,-0.91,joy,neutro,0.0,0.0,0.0,0.0,0.0,0.0,0.0,0.0
Ally Brooke,Baby I’m Coming Home,,snow falling running lights baby surprise surprise last minute catching flight gonna miss tonight matter waiting since january celebrate side side gifts tree thing missing worry holiday cause your present this year alone baby coming home worry stay promise worth wait cause this year alone baby coming home christmas making door nervous like never never glad came right time waiting since january celebrate side side gifts tree thing missing worry holiday cause your present this year alone baby coming home worry stay promise worth wait cause this year alone baby coming home christmas coming home this year alone baby coming home worry promise promise promise promise alone baby coming home christmas,Single,2020,118,-0.5,anticipation,intenso,1.0,1.0,0.72,1.0,1.0,1.0,1.0,1.0
Ally Brooke,Gone to Bed,Pop,tried block tried meditation looked around there imitation tested willpower patience comes back comes back cause thought leads text dumb know what next every time gonna last time keep believin baby could know would cause should should should left head really should gone baby could know would cause should good love actin sense really gone post point could would should baby could know would should left head really gone really want stay night twice kinda messed crossed line like hundred times best ever keep comin back never cause thought leads text dumb know what next every time gonna last time keep believin baby could know would cause should should should left head really gone baby could know would cause should good love actin sense really gone post point could would should baby could know would should left head really gone,Single,2023,155,-0.66,joy,intenso,0.41,0.0,0.83,0.12,0.0,0.0,0.37,0.0
Ally Brooke,Somebody That I Used to Know,,think together like said felt happy could told right felt lonely company love ache still remember addicted certain kind sadness like resignation always found could make sense well said would still friends admit glad over make like never happened nothing even need love treat like stranger feels rough stoop have friends collect records change number guess need though somebody used know somebody used know somebody used know somebody used know uhmm,Single,2012,74,-0.86,joy,intenso,1.0,1.0,1.0,1.0,0.64,0.64,1.0,1.0
Ally Brooke,Under The Tree,Pop,talkin santa told everythin that want year went shoppin plannin ribbons candles right here mistletoe champagne pour christmas mornin everything list waitin lookin know adore your favorite gift find tree under tree waitin christmas christmas baby unwrap unwrap unwrap know right tree next fire snowflakes falling know like guess santa listenin wishlist must checked twice mistletoe champagne pour christmas mornin everything list everything list waitin lookin know adore your favorite gift under tree find tree baby waitin christmas christmas baby unwrap unwrap unwrap know right tree right under right under right tree know right tree right tree know right tree,Single,2023,109,-0.51,joy,intenso,1.0,1.0,1.0,1.0,1.0,1.0,1.0,1.0
Ally Brooke,Have Yourself A Merry Little Christmas,Pop,have merry little christmas heart light from troubles sight have merry little christmas make yuletide from troubles miles away here olden days happy golden days yore faithful friends dear will near more dinah jane years together fates allow hang shining star upon highest bough merry little christmas have merry little christmas have merry little christmas have merry little dinah jane here olden days happy golden days yore faithful friends dear will near more dinah jane both through years together together fates allow allow hang shining star star upon upon highest bough have yourself merry little christmas merry little christmas dinah jane right right christmas merry little christmas have merry little christmas merry little christmas have merry little christmas merry christmas have merry little merry christmas have merry little merry little christmas christmas,Single,2023,148,-1.0,joy,intenso,0.56,0.0,1.0,1.0,0.0,0.0,0.19,1.0
Ally Brooke,Be You,Pop,hard doesn like wear mask front them secretly heart tugs telling dare turn them know that really wanna like them really wanna like them ahead yourself like someone else well ahead post take backwards step thinking gonna heart wrong again think right dare turn them know that really wanna like them really wanna like them ahead yourself like someone else well ahead bridge what will turn listen heart cause skin gonna better bein myself here words woah dare turn them know that know that really wanna like them ahead yourself like someone else well ahead yourself like someone else well ahead think gonna,Single,2018,116,-0.96,fear,intenso,0.0,0.26,0.0,1.0,0.52,0.52,1.0,0.26
