artist,title,genre,lyrics,Album,release_year,Word Count,score,sentiment,filter,joy,sadness,surprise,trust,anger,disgust,anticipation,fear
One Direction,Where Do Broken Hearts Go,Pop,counted mistakes there standin list things done rest crimes come close look face built house broken home then wrote song words spoke took time figured heart down searchin every lonely place every corner callin name tryna find know where broken hearts where broken hearts taste lips tongue list things want mind runnin circles anyone between enemy shadows come pain runnin from love something never heard enough took time figured heart down searchin every lonely place every corner callin name tryna find know where broken hearts sleeping baby yourself giving someone else tryna find know where broken hearts where broken hearts bridge tell tell tell feel afraid where broken hearts tell tell tell ever love again love again searchin every lonely place every corner callin name tryna find know where broken hearts sleeping baby yourself giving someone else tryna find know where broken hearts tell hidin where broken hearts come baby cause need where broken hearts tell cause feet down where broken hearts come baby come come baby come come baby cause need where broken hearts where broken hearts where broken hearts where broken hearts,FOUR,2014,204,-1.0,fear,intenso,1.0,0.25,0.0,0.0,0.26,0.51,0.25,1.0
One Direction,Diana,Alternativo,diana front pages pictures make look small could someone miss never would mistreat criminal speak different language still hear call diana light fire inside eyes lonely even know feel crying diana lift heart save life think even realise baby saving mine post diana four months fallen could someone mislead wanna reach wanna break walls speak different language still hear call diana light fire inside eyes lonely even know feel crying diana lift heart save life think even realise baby saving mine bridge need somethin could hold swear never down diana light fire inside eyes lonely even know feel crying diana lift heart save life think even realise baby saving mine post diana diana baby savin mine diana diana baby savin mine,Midnight Memories,2013,139,-0.38,fear,intenso,0.19,0.19,1.0,1.0,1.0,1.0,0.0,1.0
One Direction,Strong,Folk,hands hands tied like ships drifting weightless waves break anything save hard save heart heart tight like bookends pages written many words saying wanna wait till gone make strong sorry need care scared love cause weaker wrong wrong make strong think much love wasted people always trying escape move stop heart breaking there nothing running from make strong sorry need care scared love cause weaker wrong wrong bridge baby hold heart need keep fallin apart always hold cause make strong sorry need care scared love cause weaker wrong wrong sorry need care scared love cause weaker wrong wrong make strong sorry need care scared love cause weaker wrong wrong make strong,Midnight Memories,2013,127,-0.85,joy,intenso,0.45,0.05,0.05,0.1,0.1,0.05,0.1,0.1
One Direction,More Than This,Pop,broken hear blinded cause everything dancing alone praying heart turn around walk door head turns face floor cause look eyes opens arms holds close tonight feel right cause love lays down might inside feel right cause love love louder would would arms rescue cause same save leave gone again street arms weak body fails knees praying opens arms holds close tonight feel right cause love lays down might inside feel right cause love bridge never words asking stay little inside arms close eyes tonight pray light shining stars above breakdown opens arms holds close tonight feel right cause love cause love lays down might inside feel right cause love opens arms holds close tonight holds close tonight feel right cause love lays down might inside broken feel right cause love love,Up All Night,2011,186,1.0,joy,intenso,1.0,0.9,0.9,0.9,0.9,0.0,0.9,0.9
One Direction,I Want to Write You a Song,Folk,wanna write song beautiful sweet with hint pain feeling gone wanna write song wanna lend coat soft cheek world cold hiding place wanna lend coat everything need giving back wanna wanna build boat strong free time think heart gonna sink know wanna build boat everything need giving back wanna bridge everything need giving back wanna wanna write song make heart remember time gone listen voice sing along wanna write song wanna write song,Made In The A.M.,2015,95,-0.45,fear,intenso,0.86,1.0,1.0,0.65,1.0,1.0,1.0,1.0
One Direction,Home,R&B,make little conversation long waiting feel alive many nights thought over told kind liked something missing eyes stumbling looking dark with empty heart feel same could ever enough baby could enough alright calling somebody hold tonight lost find light never feel like alone make feel like home take wanna wake face remember good last night still high little feeling smile starts creep there eyes stumbling looking dark with empty heart feel same could ever enough baby could enough alright calling somebody hold tonight lost find light never feel like alone make feel like home bridge make feel like home baby could enough alright calling somebody hold tonight lost find light never feel like alone make feel like home,Made In The A.M.,2015,139,-0.85,joy,intenso,1.0,1.0,0.88,1.0,1.0,1.0,1.0,0.88
One Direction,Through the Dark,Indie,tell lost tell tears stay know hidin wanna tell hurt pain head held shame wanna smile again smile again burn even scream shout come back carry over fire water love hold closer hope heart strong enough night coming find through dark wish could take start never fall break heart wanna fall apart hold tell hurt vain heart love again remember laughin laugh again burn even scream shout come back back carry over fire water love hold closer hope heart strong enough night coming find through dark bridge need need worry easy loved know wanna loved breakdown carry over fire water love carry over fire water love hold closer hope heart strong enough night coming find through dark carry would would fire water love hold closer hope heart strong enough night coming down find through dark,Midnight Memories,2013,157,-1.0,sadness,neutro,1.0,0.19,1.0,0.73,0.73,1.0,1.0,0.19
One Direction,Right Now,Indie,lights down night calling hear voices singing songs street know going home long long know love feeling right wish cause right everything know fight feeling every night feel right wish late night spaces with friends love faces just like used going home long long know feeling like right wish cause right everything know fight feeling every night feel right wish bridge could forever woah woah crazy together woah woah breakdown lights down hear calling right wish cause right everything know fight feeling every night feel right wish,Midnight Memories,2013,116,-0.25,anticipation,intenso,0.12,0.12,0.89,0.89,1.0,0.89,1.0,1.0
One Direction,Hey Angel,Indie,angel know reasons look angel look laugh hold past angel wish could like wish could like wish could like wish could like post angel tell ever come side angel tell ever waste away lives wish could like wish could like wish could like wish could more could more could more post bridge edge backseat back head come alive hear voice beautiful sound beautiful noise edge backseat back head come alive hear voice beautiful sound beautiful noise breakdown angel angel look look wish could like wish could like wish like wish could like wish could like angel angel,Made In The A.M.,2015,129,1.0,joy,intenso,1.0,0.0,1.0,1.0,0.0,0.2,1.0,0.0
One Direction,Fireproof,Pop,think gonna lose mind something deep inside give think gonna lose mind roll roll luck roll roll luck feeling something deep inside hotter stream burning feeling deep inside taking taking taking taking cause nobody knows baby nobody loves baby long long maybe fireproof cause nobody saves baby think gonna time ridin wind give think gonna time roll roll change luck roll roll change luck cause nobody knows baby nobody loves baby long long must fireproof cause nobody saves baby cause nobody knows baby nobody loves baby long long maybe fireproof cause nobody saves baby,FOUR,2014,107,1.0,joy,intenso,0.26,0.7,1.0,0.35,0.7,0.7,1.0,1.0
One Direction,Live While We’re Young,Pop,girl waitin waitin come sneak celebration celebration music windows down doin just pretendin cool know keep doin just pretendin cool tonight crazy crazy crazy till know pretend love never never never stop anyone tonight live young post live young tonight live young girl never never overthink together together pictures leave phone doin just pretendin cool tonight crazy crazy crazy till know pretend love never never never stop anyone tonight live young post wanna live young tonight live young bridge girl bout make memories tonight wanna live young wanna live young crazy crazy crazy till till know pretend love never never never stop anyone anyone tonight live young young crazy crazy crazy till know pretend love pretend love never never never stop anyone tonight some live young wanna live wanna live wanna live young young wanna live wanna live wanna live young wanna live young wanna live wanna live wanna live young tonight live young,Take Me Home,2012,185,-1.0,sadness,neutro,0.18,1.0,1.0,1.0,0.1,0.0,0.14,1.0
One Direction,Happily,Pop,understand understand hold hand meant twist fate made walk away cause fire fire fire fire fire fire three care people together know wanna hold sleep want forever know wanna leave baby happily know wonder knows touched skin feels traces hair sorry love really care cause fire fire fire fire fire fire three care people together know wanna hold sleep want forever know wanna leave baby happily happily bridge three four fire fire fire fire care people together know wanna hold sleep want forever know wanna leave baby happily care people together know wanna hold sleep want forever know wanna leave baby happily,Midnight Memories,2013,132,-0.5,fear,intenso,1.0,1.0,1.0,0.0,0.0,0.0,1.0,1.0
One Direction,Rock Me,Pop,remember summer wanna back every night just best time life lyin beach blew playing guitar fire loud could never shut down used think better alone ever wanna under moonlight stared words whispered always believe want rock rock rock want rock rock rock want pedal heavy metal show care want rock rock rock together summer wanna roll back like pressing rewind mine never said goodbye used think better alone better alone ever wanna under moonlight stared stared words whispered always believe want rock rock rock want rock rock rock want pedal heavy metal show care want rock rock rock rock bridge again again again want again again again breakdown want rock rock rock want rock rock rock want pedal heavy metal show care care want rock rock rock rock rock want rock rock rock rock want rock rock rock rock want pedal heavy metal show care show care want rock rock rock rock,Take Me Home,2012,198,-0.25,fear,intenso,0.55,0.22,0.0,0.27,0.11,0.0,0.55,0.27
One Direction,Girl Almighty,Pop,light loud many ambulances takes save saviour woah woah woah floats room balloon some fake love made another toast girl almighty pray stay young stay made lightnin only believer there there something happening here there something happening here only believer there there something happening here hope feel feeling post down down knees down down knees knees light loud many ambulances takes save saviour woah woah woah floats room balloon some fake love made another toast girl almighty pray stay young stay made lightnin only believer there there something happening here there something happening here only believer there there something happening here hope feel feeling post down down knees knees down down knees knees,FOUR,2014,136,0.25,joy,intenso,0.26,1.0,1.0,1.0,1.0,1.0,1.0,0.76
One Direction,Better Than Words,Pop,better words more feeling crazy love dancing ceiling every time touch shook make wanna deep love knows baby know else cause words good enough there explain love know else cause words good enough explain love better words post better words better words drive crazy someone like always baby best ever hips make wanna night irreplaceable crazy crazy know else cause words good enough there explain love there explain love know else cause words good enough explain love bridge everyone tries they feels like feels like never right cause better better better interlude time better words know else know cause words good enough there explain love know else cause words good enough words good enough explain love explain love better words post better words better words,Midnight Memories,2013,160,1.0,anger,intenso,0.22,0.78,1.0,0.17,0.22,1.0,1.0,0.78
One Direction,Half a Heart,Indie,friend telling sleepin sweater stop missin friend telling doin much better because missin half bein without like wakin only half blue kinda there quite walking around shoe half heart without half best with half arrow chest cause miss everything half heart without forget said night even matter cause split could spare hour lunch river really talk through bein without like wakin only half blue well kinda there quite walking around shoe half heart without half best with half arrow chest cause miss everything half heart without post half heart without half heart without bridge though head truth lost without since then wakin only half blue only half blue kinda there quite walking around shoe half heart without half best half best with half arrow chest miss everything half heart without without without half heart without without without without without half heart without,Midnight Memories,2013,169,-1.0,sadness,neutro,0.2,0.5,0.0,0.3,0.0,0.0,0.0,0.0
One Direction,Don’t Forget Where You Belong,Pop,been places around world seen faces never knowing horizon know know know know rising back home living cases packing taking made changes forgetting horizon well know know know know moon rising back home forget belong home forget belong home ever feel alone never proof song away ages everything need flicking pages written memory feel like dreaming know know know know never leaving forget belong home forget belong home ever feel alone never proof song bridge lights even stars skies wrong short days nights long think things done matter gone always free home breakdown forget belong home forget belong forget home ever feel alone never never never never home forget belong home forget belong forget home ever feel alone never never proof song post home forget home ever feel alone never never proof song never forget song forget never forget song never,Midnight Memories,2013,172,-1.0,anticipation,intenso,1.0,0.0,0.0,1.0,0.0,0.0,1.0,0.0
One Direction,Wolves,Folk,hear calling hear calling feel waves getting started rush inside control your eyes keep pulling know know know your friends talking bout they chance fire burning deep soul soul soul debating taking whole world shaking middle night wolves come headed straight heart like bullet dark take down hide going without fight hear calling hear callin middle night wolves come headed straight heart come straight heart post hear calling hear calling keep holding tight cause body telling gonna starting trouble know know know just bringing demons more ever your beauty could start walk door debating taking whole world shaking middle night wolves come headed straight heart like bullet dark take down hide going without fight hear calling hear callin middle night wolves come headed straight heart come straight heart post hear calling hear calling bridge wish true whole world tryna piece heart keeps fightin battle fools gotta make through gotta make through middle night wolves come headed straight heart like bullet dark take down hide going without fight hear calling hear callin middle night wolves come headed straight heart come straight heart post hear calling hear calling,Made In The A.M.,2015,210,-1.0,fear,intenso,0.9,1.0,1.0,1.0,1.0,0.0,1.0,0.4
One Direction,Never Enough,Alternativo,wanna pull nighter something never forget wanna stay party weekend away know quit wanna drive night earth edge wanna wake baby again lips good forget name swear could give everything need love take take take need heart break break break much baby never never enough never enough never enough never enough post come come wanna pull nighter something never forget wanna stay party weekend away know quit wanna drive night earth edge wanna wake baby again lips good forget name swear could give everything need love take take take need heart break break break much baby never never enough never enough never enough never enough post come come come come bridge much never enough much never enough much never enough much much never enough much never enough much never enough much never enough never enough never never never need love take take take take need heart break break break break much baby never never enough never enough never enough need love take take take take need heart break breaking heart break break much baby never never enough never never never never never never never enough never enough never enough never enough post come come come come come come babe,Made In The A.M.,2015,227,0.42,surprise,intenso,1.0,1.0,1.0,0.81,0.0,0.0,0.4,1.0
One Direction,Long Way Down,R&B,made fire went flames sailed ocean drowned wave built cathedral never prayed walked away point return late turn around forgive struggle cause know built high falling long down long here mountain took granted spaceship land found island stranded could planned point return late turn around forgive struggling cause know built high falling long here such long here long down long down such long down long down long,Made In The A.M.,2015,79,-1.0,anticipation,intenso,0.9,1.0,0.0,0.9,1.0,0.0,1.0,0.9
One Direction,Clouds,R&B,clouds clouds know like complicated keep simple love never ever simple someday gonna things gonna want breathe gonna wish never left here again another round friends another stop ever here again another round friends another stop ever never comin back down lookin clouds post know said like complicated tired changes well love always always changing woah someday gonna things gonna want breathe gonna wish never left here again another round friends another stop ever here again another round friends another stop ever never comin back down lookin clouds bridge stop clouds ever grow clouds stop clouds ever grow here again another round friends another stop ever here again another round friends another stop ever here again stop here again another round friends here again ever grow another stop ever here here again stop another round friends another stop ever here again,FOUR,2014,162,-1.0,joy,intenso,1.0,0.0,0.0,0.27,0.0,0.0,0.27,0.0
One Direction,Moments,Folk,shut door turn light wanna wanna feel love wanna beside cannot hide even though heart beats harder time escapes trembling hands touch skin makes harder tears stream face could life could turn back time know life voice your reason love heart breathing moment time find words leave today close door throw wanna reminded wanna seen wanna without judgement clouded like tonight hands silent voice numb scream lungs makes harder tears stream face could life could turn back time know life voice your reason love heart breathing moment time find words leave today bridge flashing lights mind going back time playing games street kicking balls feet there numb toes standing close edge there pile clothes feel fall make joke know life voice your reason love heart breathing moment time time find words leave today know life voice your reason your reason love heart breathing breathing moment time find words leave today,Up All Night,2011,171,-0.32,sadness,intenso,1.0,0.25,1.0,0.0,0.12,0.21,1.0,1.0
One Direction,Ready to Run,Pop,there lightnin eyes deny then there inside sinking boat runnin time without never make alive know know alright there devil smile chasing every time turn around gaining speed there moment finally realise there change rolling tide know know fine time ready escape city follow cause wanna yours wanna mine wanna lost dark night time ready wherever place belong cause wanna free wanna young never look back ready post ready there future life foresee unless course stay course keep next there always kind criticize know know alright time ready escape city follow cause wanna yours wanna mine wanna lost dark night time ready wherever place belong cause wanna free wanna young never look back ready bridge time ready ready give everything love time ready escape city follow cause wanna yours wanna mine wanna lost dark night time ready time ready wherever place belong cause wanna free wanna young never look back ready,FOUR,2014,174,-1.0,anticipation,neutro,1.0,1.0,1.0,1.0,1.0,1.0,0.32,1.0
One Direction,Spaces,Pop,gonna first start fight gonna first fall asleep night gonna last drive away gonna last forget place keep taking turns will ever learn spaces keep getting deeper harder reach even though tried spaces hold secrets leavin speechless know gonna first goodbye gonna first compromise gonna first fire gonna last drive away forgetting every single promise ever made spaces keep getting deeper harder reach even though tried spaces hold secrets leavin speechless know gonna first goodbye bridge keep taking turns will ever learn learn spaces keep getting deeper harder reach even though tried spaces hold secrets leavin speechless know gonna first goodbye post gonna first goodbye spaces spaces spaces spaces,FOUR,2014,131,-0.21,fear,neutro,1.0,1.0,0.0,1.0,1.0,0.0,1.0,0.28
One Direction,I Would,Alternativo,lately found thinking been dreaming head boyfriend thing already drives school every morning while walk alone rain kill without warning took look brain would well would would would hold feeling baby know would would would well would would would hold feeling baby know would back head kissing thought things going alright alright alright alright with sign back saying kick reality ruined life tommo feels like constantly playing game destined lose cause compete boyfriend twenty seven tattoos would well would would would hold feeling baby know would would would well would would would hold feeling baby know would post would would bridge would please would kiss would treat like would would would touch would need would love like would breakdown would well would would hold feeling baby know would would please would please would kiss would kiss would treat like would like would would touch would touch would need would need would love like would like would would well would would like would would hold feeling baby know would would would,Take Me Home,2012,191,-0.28,joy,intenso,0.2,0.11,0.12,0.11,0.11,0.1,0.13,0.12
One Direction,Little Black Dress,R&B,little black dress walked room makin heads turn stop looking right right right know little black dress come alone late late late home alright alright alright know alright alright alright know wanna move baby wanna move baby wanna move little black dress doin little black dress take more right right right know little black dress favorite song little black dress harm alright alright alright know alright alright cause take home wanna move baby wanna move baby wanna move guitar solo wanna move baby wanna move baby wanna move wanna move baby wanna move baby wanna move,Midnight Memories,2013,106,-0.54,sadness,intenso,1.0,0.47,0.0,1.0,0.0,0.0,0.0,1.0
One Direction,Something Great,Indie,come world together even lost words thought never said better together want like pictured keep imaginin come jump come bring everything much something great script written could change thing want shreds start again come world right better together tonight want like pictured keep imaginin come jump come bring everything much something great bridge want like pictured keep imaginin come jump come bring everything much something great want like pictured much something great want much hurtin want much hurtin,Midnight Memories,2013,95,-1.0,joy,neutro,0.37,0.12,0.0,0.0,0.12,0.0,0.25,0.12
One Direction,Act My Age,Pop,three four kids think joke cause move little slow dance count through cause know always understand still feel around kids think joke cause stories told tell again count cause know truly understand still feel around still feel same will bridge hardly walk hair fallin still stay till mornin throw after party still feel around still feel same will,FOUR,2014,76,-0.14,trust,intenso,0.25,0.0,0.0,0.75,0.0,0.0,0.0,0.0
One Direction,Little White Lies,Alternativo,room burnin even notice cause takin mind with little white lies little white lies gettin late gettin late know stay stay tell truth like playing games your hands touching touching eyes keep saying things they sayin concentrate thinkin about keep thinkin about everythin else fades away room burnin even notice cause takin mind with little white lies little white lies good girl know would girl cause telling night with little white lies little white lies with little white lies little white lies back seat lips getting attached attached wanna make rules cool watch break tonight know want waiting long room burnin even notice cause takin mind with little white lies little white lies good girl know would girl cause telling night with little white lies little white lies with little white lies little white lies bridge know want know feel stop pretending know know just came breakdown room burnin burnin burnin even notice cause takin mind taking mind with your with little white lies little white lies little white lies good girl good girl good girl know would girl know would girl cause telling night night with your with little white lies little white lies little white lies your with little white lies little white lies,Midnight Memories,2013,227,1.0,anticipation,intenso,1.0,0.31,0.62,0.29,1.0,0.0,0.3,1.0
