artist,title,genre,lyrics,Album,release_year,Word Count,score,sentiment,filter,joy,sadness,surprise,trust,anger,disgust,anticipation,fear
Louis Tomlinson,Defenceless,Rock,come runnin like moth flame tell take easy easier wish need much hate sleepin problems like solve dreams wake early morning still sheets lost head spinnin again tryna find been night night runnin lines truth been night sure right much lose never defenceless never defenceless keep buildin fences never defenceless post keep buildin fences never defenceless keep strong acting like feel pain know know inside lost pride thing prove been night night runnin lines truth been night sure right much lose never defenceless never defenceless keep buildin fences never defenceless post keep buildin fences never defenceless bridge hope asking much just wanna loved defensive tired tough just wanna loved never defenceless never defenceless keep buildin fences never defenceless post keep buildin fences defenceless never defenceless never defenceless keep buildin fences never defenceless,Walls,2020,143,-0.27,sadness,intenso,0.62,1.0,0.93,0.93,0.93,0.93,0.31,0.25
Louis Tomlinson,Two of Us,Alternativo,minute since called just hear answerphone know leave message alone morning woke still dreaming with memories playing head never know much miss took wish instead told give diamonds turn dust fade away keep night living life best always keep next living life even know alone tattooed heart words favourite song know looking down swear gonna make proud living life feel blood written looking back every mirror know waiting again told give diamonds turn dust fade away fade away keep night living life best always keep next living life even know alone tattooed heart words favourite song know looking down swear gonna make proud living life bridge promised swear living through everything ever keep night living life best always keep next living life even know alone tattooed heart words favourite song know looking down swear gonna make proud living life post life living life like started just else hold heart life,Walls,2019,163,1.0,trust,intenso,1.0,0.55,0.55,0.38,1.0,0.0,1.0,0.0
Louis Tomlinson,Miss You,Rock,imagination something takin smiles fakin everythin great everythin fucking great goin every weekend starin stars ceiling hollywood friends gotta them such good time believe time tuesday night glazed eyes just pint five does even matter anyway dancin tables face with people better singing till last call tune should laughing there something wrong hits lights shit maybe miss just like sober asking myself over maybe lying told everythin great everythin fucking great thoughts feelings cheers need them checking phone evenin such good time believe time tuesday night glazed eyes just pint five does even matter anyway dancin tables face with people better singing till last call tune should laughing there something wrong hits lights shit maybe miss bridge asking friends sorry they give time there need worry even phone even alone shit changes love strangers when feel comin throw away another shots cause matter anyway dancin tables face with people better singing till last call tune should laughing there something wrong hits lights dancin tables face with people better singing till last call tune should laughing there something wrong hits lights shit maybe miss,Walls,2017,190,1.0,anticipation,intenso,1.0,0.32,0.64,0.64,1.0,1.0,1.0,0.32
Louis Tomlinson,Too Young,Rock,young know everything young wish could seen along sorry hurt darling young looking back lately ever known hard think could ever hate everything feeling different believe gave pressure when said love like would never last cause know better realize realize young know everything young wish could seen along sorry hurt darling young young young face face kitchen table everything waited finally conversation wish could before believe gave pressure when said love like would never last cause didn know better realize realize young know everything young wish could seen along sorry hurt darling young young young bridge years since seen face tryna find better words before moment slip away cause realize young know everything young wish could seen along sorry hurt darling young young young young young,Walls,2020,139,1.0,joy,intenso,1.0,1.0,1.0,1.0,0.69,1.0,1.0,1.0
Louis Tomlinson,Fearless,Rock,cash weekend treasures suit second wife saying could done better just remember seen fire alight tell tell still remember feelin young tell truth tell still remember feelin young strong enough wrong front people just tonight look inside spark memory strong enough wrong front people post fearless fearless fearless fearless happiness always measured life design drive then feel better ever know well lies tell tell still remember feelin young tell truth tell still remember feelin young strong enough wrong front people just tonight look inside spark memory strong enough wrong front people post fearless fearless fearless fearless fearless fearless fearless fearless tell tell still remember feelin young,Walls,2020,117,1.0,fear,intenso,1.0,0.0,1.0,1.0,0.26,0.0,1.0,0.36
Louis Tomlinson,Habit,Rock,always said mess eventually told expect from shouldn come surprise anymore know said give another chance knew truth advance mentally already door never thought giving would hard missing addictive heart habit break feelin down shiver shake habit break high need right habit break took time cause energy playing someone heard supposed honestly choose anymore ages different stages come princess park always need front front habit break feelin down shiver shake habit break high need right habit break bridge give time space control sorry down guess know already knew better miss habit break feelin down shiver shake habit break high need right habit break habit break feelin down shiver shake habit break high need right habit break,Walls,2020,125,0.2,surprise,intenso,1.0,1.0,0.36,1.0,1.0,0.21,1.0,1.0
Louis Tomlinson,Walls,Rock,nothing wakes like wakin alone left cupboard full clothes walked away took higher ground became high walls came short stand taller these high walls never broke soul watched come fallin down watched come fallin nothing makes hurt like hurtin love hurtin love amount words ever enough will ever enough looked eyes lost lost every question because high walls came short stand taller these high walls never broke soul watched come fallin down watched come fallin fallin bridge thank thank often bittersweet hope high walls came short stand taller these high walls never broke soul watched come fallin down watched come fallin fallin nothing wakes like wakin alone,Walls,2020,114,-1.0,sadness,intenso,1.0,0.31,0.52,1.0,1.0,0.0,0.52,1.0
Louis Tomlinson,Perfect Now,Rock,jeans feel pretty hard miss wish could point view someone starin back friday night turn looking down wanna dance know love dance never stop given half chance just keep head love keep head hide away ever change keep head love keep head look away look away cause everybody lookin guess queens need crown know even tears fallin down still somehow perfect never asked tell truth lyin next cause said done make feel like someone good even worst steal scene unrehearsed wanna dance just little dance never stop given half chance just keep head love keep head hide away ever change keep head love keep head look away look away cause everybody lookin guess queens need crown know even tears fallin down still somehow perfect bridge every insecurity like neon sign bright knew would never hide away cause everybody lookin guess queens need crown know even tears fallin down still somehow perfect,Walls,2020,158,1.0,joy,intenso,0.29,0.62,0.12,1.0,1.0,0.0,1.0,0.18
Louis Tomlinson,Don’t Let It Break Your Heart,Rock,twenty seven place side london doing better doing better know left part york better better life gets hard gets messed when give much enough when high high when love someone kill even hurts like hell whatever tears apart break heart time takes time heal yourself whatever tears apart break heart comes goes driving road something better something better hurts gonna pass learnt comes back better better cause life gets hard gets messed when give much enough when high high when love someone kill even hurts like hell whatever tears apart break heart time takes time heal yourself whatever tears apart break heart bridge break heart cause life gets hard gets messed when give much enough when high high when love someone kill even hurts like hell whatever tears apart break heart time takes time heal yourself whatever tears apart break heart break heart break heart break heart break heart break heart break heart break heart break heart break heart break heart break heart,Walls,2019,174,0.24,surprise,intenso,1.0,1.0,1.0,1.0,1.0,1.0,1.0,1.0
Louis Tomlinson,We Made It,Rock,cause made underestimated always underrated saying goodbye waving hard times gonna alright like first time doorstep remember tasted looking eyes baby still high never coming hand mine post remember nights meet cheap drinks drink night staying sunrise share single tell dream about things never someone else loud kids tryna work wonder think could cause made underestimated always underrated saying goodbye goodbye waving hard times knew would alright from first time doorstep remember tasted looking eyes baby still high never coming hand mine post could become know young done pretty good dealing when here need more nothing world would change singing something four chords used worry bout more cause made underestimated always underrated saying goodbye goodbye waving hard times smoke something drink something like first time doorstep remember tasted looking eyes baby still high never coming hand mine post with hand mine cause made cause made never coming hand mine cause made,Walls,2019,211,1.0,anticipation,intenso,0.25,0.35,0.71,1.0,0.35,0.0,1.0,0.71
Louis Tomlinson,Kill My Mind,Rock,nightmare dance floor hate want more total distraction while waiting reaction devil brain whispering name hear sayin ease pain just little taste babe hold kill mind raise body back life know without kill mind raise body back life know without kept living from last time from prison past life mission feel like when kissed last time devil brain whispering name hear sayin ease pain just little taste babe hold kill mind raise body back life know without kill mind raise body back life know without kill mind raise body back life know without bridge kill kill kill kill kill kill kill kill kill kill kill kill kill mind raise body back life know without kill mind raise body back life know without kill mind raise body back life know without,Walls,2019,138,-1.0,fear,intenso,1.0,0.39,0.0,1.0,0.6,1.0,0.6,0.4
Louis Tomlinson,Bigger Than Me,Rock,when somebody told would change used hide behind smile when somebody told would change afraid know cause world outside realised read signs walkin different lines know took left tryna make right refrain voices choices hear anymore hear anymore when somebody told would change hide behind smile somebody told would change afraid know cause world outside realised bigger bigger woken sleep bigger bigger come call liar quick judge cause mighta changed everybody does refrain voices choices hear anymore hear anymore when somebody told would change used hide behind smile when somebody told would change afraid know cause world outside realised bigger bigger woken sleep bigger bigger bridge ever black white sleep night like cause feel alive realise world outside bigger bigger woken sleep bigger bigger,Faith in the Future,2022,134,-1.0,fear,neutro,1.0,0.33,0.1,1.0,0.0,0.33,0.66,1.0
Louis Tomlinson,Silver Tongues,Rock,gettin high amber wave going deep ones same maxes silver tongues settle another heavy said love pretty choked smoke logic empty cans know nobody understands like know times like much happier nights like these remember thos stupid jokes only know know much happi nights like these remember songs wrote only know smile time feel like goin home said grass dirty drug like preach vodka love things know king fifty metre road stand tall beat chests shout things regret master plan know nobody understands like times like much happier nights like these remember stupid jokes only know know much happier nights like these remember songs wrote only know smile time feel like goin home bridge wakin start again wakin start again there nowhere else would rather because times like much happier nights like these remember stupid jokes only know know much happier nights like these remember songs wrote only know smile time feel like goin home,Faith in the Future,2022,162,1.0,anticipation,intenso,0.25,1.0,1.0,1.0,1.0,1.0,0.29,0.0
Louis Tomlinson,Written All Over Your Face,Rock,babe written face hurricane behind door come ready when want coffee morning know hole hard enough sober chance hungover even woken nearly vertical know trouble cause atmosphere cold babe written face hurricane behind door come ready when thunder distance know tting close giving silent treatment know achieving when finished saying nothing please back loving when good really something please back break babe written face hurricane behind door come ready babe written face find fighting ready talk written your written face written your written face,Faith in the Future,2022,91,1.0,anticipation,intenso,0.12,0.0,0.18,0.12,0.62,0.0,0.31,0.18
Louis Tomlinson,Change,Rock,time lives easy gettin complete long away know everything changed cause inside still kings friday nights silver streets neon signs everything changed outside sometimes wonder need call friend need cause everything changed outside feel inside kids alright used always losin minds street trip memory lane houses look same there different names gates people changed shame nothing stays same cause inside still kings friday nights silver streets neon signs everything changed outside sometimes wonder need call friend need cause everything changed outside feel inside bridge when gonna realise another life always overanalyse point know alright still rest lives time realise another life always overanalyse point know alright cause inside still kings friday nights silver streets neon signs everything changed outside sometimes wonder need call friend need cause everything changed outside feel inside time realise another life always overanalyse point know alright cause inside,Faith in the Future,2022,152,1.0,anticipation,intenso,1.0,0.71,0.71,1.0,0.0,0.71,0.28,0.71
Louis Tomlinson,Chicago,Rock,baby names liked brother doin okay still gettin fights sorry like sorry brought myself they bitter ends turn sweet time true mine cause lonely chicago call baby long enough forgive just work mean meaningless meant have seen life goin cause wondering would told keep goin would walk away always made feel much tter always grateful bitter ends turn sweet time true mine feel lonely chicago call baby long enough forgive just work mean meaningless search cause still know number think remember just work mean meaningless meant post meant meant meant lonely chicago call baby long enough forgive just work mean meaningless search cause still know number sometimes still like wear jumper just work mean meaningless meant,Faith in the Future,2022,125,0.81,joy,intenso,0.2,0.2,0.05,0.15,0.75,0.75,0.17,0.75
Louis Tomlinson,Lucky Again,Rock,give give gone away just tell another lived life hard worked yourself believe superman they selling tickets cinema whatever gets darkest night just find light madness hold tight cause hard lose figured made back life would choose lucky once could lucky again befor world serious before time away meet favourite subway stop grab food meet lads believe superman they selling tickets cinema whatever gets darkest night just find light madness hold tight cause hard lose figured made back life would choose lucky once could lucky again hard find figured love look back time lucky once could lucky again bridge cause hard lose figured made back life would choose lucky once could lucky again hard find figured love look back time lucky once could lucky,Faith in the Future,2022,134,0.27,joy,intenso,1.0,1.0,0.25,1.0,1.0,1.0,1.0,0.98
Louis Tomlinson,Saturdays,Rock,supposed feelin dirty cheap silver street quarter three hidden across face crowd countin days haze gazin floor somebody trainers ones wore when walked door wonderin first time last time thinking bout things used first time last time always used saturdays take pain away nobody stays same matter much want some things change post some things change through cigarette shadow sticks carpet ignore somethin light catches mirror brain gives shade starin door somebody trainers ones wore anymore wonderin first time last time thinking bout things used first time last time always used saturdays take pain away nobody stays same matter much want some things change post some things change some things change some things change bridge heart might broken broken down heart might broken broken down always used saturdays take pain away nobody stays same matter much want much want always used saturdays take pain away nobody stays same matter much want some things change,Faith in the Future,2022,163,-0.44,fear,intenso,0.0,1.0,0.0,0.0,1.0,0.25,1.0,1.0
Louis Tomlinson,The Greatest,Rock,tell nothing could make late said plan time came changed disappear cause nothing gets here through circle round heart where best start said know alone only just good rest together greatest never cold again fallin pieces atest life never over know something your face reminded love cannot hide need tell back dancin dark back start findin pieces making missed said know alone only just good rest together greatest never cold again fallin pieces greatest life never over greatest never cold again fallin pieces greatest life never over greatest greatest,Faith in the Future,2022,96,0.13,anticipation,intenso,1.0,1.0,1.0,1.0,0.0,0.0,1.0,1.0
Louis Tomlinson,All This Time,Rock,three four late tryna find words ages just patience spend time waste keep building mountains hoping turn gold truth still doubt home when gets cold sometimes sometimes lose hope eyes meet tell walls trees keep building mountains hoping turn gold truth still doubt home when gets cold sometimes sometimes lose hope friends make love takes worth worth worth pain friends make love takes worth worth worth time time time worth time,Faith in the Future,2022,79,0.81,anticipation,intenso,0.1,0.15,0.1,0.17,0.75,0.75,0.2,0.12
Louis Tomlinson,Angels Fly,Rock,nothin really matters nothin really hurts talk make worse there time sayin where went wrong wanna hear right need know okay talk tomorrow time borrow every star angels knock door save callin word wait till mornin every star angels look horizon does make feel small pain behind need anymore there time sayin wher went wrong wanna hear right know wher goin there problems empty bottle bottom drained right need know okay talk tomorrow time borrow every star angels knock door save callin word wait till mornin every star angels angels high angels angels angels high angels angels,Faith in the Future,2022,109,1.0,anticipation,intenso,1.0,0.13,0.0,0.22,0.0,0.0,0.36,1.0
Louis Tomlinson,She Is Beauty We Are World Class,Rock,conversation currency shapes become language square eyes sunglasses finding faces trees fabricated fairytales bring world life down space time beauty world class forever feeling last escape inevitable fade light soak empathy cause tonight have before beauty world class forever feeling last beauty world class forever feeling last post bridge surrounded light surrounded light surrounded light surrounded light surrounded light surrounded light surrounded surrounded surrounded surrounded beauty world class forever feeling last beauty world class forever feeling last have before,Faith in the Future,2022,86,0.81,joy,intenso,1.0,1.0,1.0,1.0,1.0,1.0,1.0,0.12
Louis Tomlinson,Holding On To Heartache,Rock,said holdin heartache said wear like crown gonna drag down holdin heartache starin birds passin love wind held knew would change creates strangest feelin just slowly waitin still dreams moments came moments never shown because faded darkness refrain still hear silence still hear clock tickin said holdin heartache said wear like crown gonna drag down holdin heartache starin birds passin love holdin heartache nights change seasons become strangest days called twice regretted changed number questions where wrong there endless versions thing keeps driftin back darkness refrain still hear silence still hear clock tickin said holdin heartache said wear like crown gonna drag down holdin heartache starin birds passin love bridge know party over when standin empty space alone time always heal make bones nothing ever easy honest easy myself second space comes floodin back said holdin heartache said wear like crown gonna drag down holdin heartache starin birds passin love,Faith in the Future,2022,159,-0.17,sadness,intenso,1.0,0.33,0.0,1.0,0.95,1.0,0.71,1.0
Louis Tomlinson,Face the Music,Rock,good right wrong stories made young scare love hate between depends reality them wanna stay moment rest life night gonna choose wanna face music still wanna dance time wanna face music still wanna dance still wanna dance with close eyes count standin edge fallin open looking down everything matters forgotten wanna stay moment rest life night gonna choose wanna face music still wanna dance time wanna face music still wanna dance still wanna dance with post night gonna choose wanna face music still wanna dance time wanna face music still wanna dance still wanna dance with,Faith in the Future,2022,104,-0.2,sadness,intenso,1.0,1.0,0.34,1.0,1.0,1.0,0.69,1.0
Louis Tomlinson,Headline,Rock,sometimes wake hear silence pride hide beauty kindness fast judge error thought knew better quick kill forever used read like headline many reasons mine maybe taken time still wanna talk every night head scared find used like headlin reason mine anymore spent summer workin education while runnin dreams kept waitin never told never guess never knew shortest forever thought could forget used read like headline many reasons mine maybe taken time still wanna talk every night head scared find used read like headline reason mine anymore post used read like headline used read like headline sometimes wake wish beside,Faith in the Future,2022,107,-0.45,fear,neutro,1.0,1.0,0.66,0.0,0.0,0.0,1.0,1.0
Louis Tomlinson,That’s the Way Love Goes,Rock,here words know wanna hear think moved mate almost year seen here given space pick phone cause time learnt love goes love goes remember told give time well here chance take advice goin somewhere regret cause town easy forget love goes guess love goes when cuts bleed feelin most love goes post here words know wanna hear think moved mate almost year gonna make sure okay cares loss anyway love goes love goes when cuts bleed feelin most love goes love goes love goes when cuts bleed feelin most love goes post love goes,Faith in the Future,2022,129,0.13,joy,intenso,1.0,1.0,0.68,1.0,1.0,0.0,0.68,1.0
Louis Tomlinson,Common People,Rock,came good home house full terrace dreams enough know believe refrain late nights good times mistakes heartbreaks when lost back started common people nothing changed hear strangers singin name like like common people know just willin like took local deep pockets hearts screamin dance floor refrain late nights good times heartbreaks mistakes when lost back started common people nothing changed hear strangers singin name like just like common people know just willin like like common people nothing changed hear strangers singin name like just like common people know just willin like just like just like,Faith in the Future,2022,102,1.0,joy,intenso,0.22,0.22,1.0,0.22,0.0,0.0,1.0,0.0
Louis Tomlinson,Out of My System,Rock,slowly never wanna slowly wanna faster towards disaster every time with know wanna come with take anything carry leave everythin else behind half think gotta system gotta chest lived life already gotta rest demons takin demons putting them cause wanna feel alive half think gotta system gotta chest lived life already gotta rest post gotta system system gotta system gotta system gotta head lived life already gotta rest post gotta system system gotta system gotta system system gotta system,Faith in the Future,2022,90,0.63,trust,intenso,0.32,0.19,0.64,1.0,0.32,0.32,0.64,1.0
Louis Tomlinson,High In California,Rock,blue like light surroundin seems different around waves waves green keep comin like dream nothin same goes changes never holdin anyone else when take somewhere better before wanna california smoke weed outside summertim they always said everything feel alive spent whole life thinkin change spent whole life thinkin change wanna california smoke weed outside summertime post time could roll windows down golden hour wash room hope always stays around clouds smoke come bloom when goes changes never holdin anyone else when take somewhere better before wanna california smoke weed outside summertime they always said everything makes feel alive spent whole life thinkin change spent whole life thinkin change wanna california smoke weed outside summertime post time time wanna california smoke weed outside summertime wanna california smoke weed outside summertime they always said everything makes feel alive spent whole life thinkin change spent whole life thinkin change wanna california smoke weed outside summertime,Faith in the Future,2022,161,-1.0,fear,neutro,1.0,0.19,1.0,1.0,0.0,0.0,1.0,1.0
