title,lyrics,Album,release_year,Word Count,joy,sadness,surprise,trust,anger,disgust,anticipation,fear,score,sentiment,filter,joy_norm,sadness_norm,surprise_norm,trust_norm,anger_norm,disgust_norm,anticipation_norm,fear_norm
Going Nowhere,flict first give girl credit keep lovin cause realest night that stay side always right thing matter cause nobody perfect know leave make stay where going tryna tryna where going tryna baby baby where going tryna tryna where going tryna baby cause know stay better listen words going nowhere going nowhere better like sense cause dime money well spent going nowhere going nowhere start pointin fingers wish loved loved baby same make work baby crazy love hate thin line where going tryna where tryna where going tryna baby baby woah where going tryna where going tryna where going tryna baby cause know stay better listen words going nowhere going nowhere better like sense cause dime money well spent going nowhere going nowhere nowhere bridge waitin waitin night gonna play games gonna lose sorry goodbye still want need happy still must blind where going tryna where goin tryna tryna where going tryna baby baby where goin tryna baby where going tryna where going tryna baby cause know stay down better listen words going nowhere going nowhere going nowhere better like sense like sense cause dime money well spent going nowhere going nowhere nowhere cause know stay better listen words words going nowhere nowhere going nowhere nowhere better like sense cause dime money well spent going nowhere going nowhere going nowhere going nowhere,Reflection,2015,256,19,4,6,7,12,2,7,3,0.5813953488372092,joy,intenso,0.4418604651162791,0.057971014492753624,0.10909090909090909,0.21428571428571427,0.1643835616438356,0.028169014084507043,0.2413793103448276,0.04477611940298507
Them Girls Be Like,look should call back wear hair like that make stacks ever around hear talkin crazy like ever post pics filter hashtag woke like them girls like them girls like them girls like them girls like that like that like lovin life cause really care that like that like lovin life cause really care hatin phase take selfie every night least hundred likes ever around hear talkin crazy like ever post pics filter hashtag woke like them girls like them girls like them girls like them girls like that like that like lovin life cause really care that like that like lovin life cause really care bridge like girls much thirsty think boys missin woah woah know hate girls much thirsty think boys missin woah woah them girls like them girls like them girls like them girls like that like that like lovin life cause really care that like that like lovin life cause really care,Reflection,2014,180,0,3,0,1,3,1,0,3,0.4244186046511629,sadness,intenso,0.0,0.043478260869565216,0.0,0.0,0.0410958904109589,0.014084507042253521,0.0,0.04477611940298507
This is How We Roll,this roll stay street week cause this roll gotta stay house cause party every weekend turn baby burn again this roll rollin rollin rollin drop everybody party everybody party came party came party better move body better move body damn look body damn look body everybody everybody here hands hands wave like care wave like care hear this place jumpin keep bumpin boys keep watchin wanna leave somethin makin clap makin clap clap clap clap clap clap clap clap clap need hands need hands that that that that that cause this roll stay street week cause this roll gotta stay house cause party every weekend turn baby burn again this roll rollin rollin rollin drop wild crazy wild crazy wanna crazy wanna crazy free young free young blame clear clear boys boys there keep lookin here keep lookin here care this place jumpin keep bumpin boys keep watchin wanna leave somethin makin clap makin clap clap clap clap clap clap clap clap clap need hands need hands that that that that that cause this roll stay street week cause this roll gotta stay house cause party every weekend turn baby burn again this roll rollin rollin rollin bridge pull camera woah cause someone woah gonna wanna woah woah take picture snap post world woah woah cause going town better believe woah woah sexy sexy girls girls girls roll this roll roll stay street week cause stay street cause this roll roll gotta stay house cause party party every weekend every weekend turn baby burn this roll this roll roll roll rollin rollin rollin rollin rollin rollin rollin drop this roll,Reflection,2015,301,26,11,6,20,7,3,22,9,0.7325581395348837,joy,intenso,0.6046511627906976,0.15942028985507245,0.10909090909090909,0.6785714285714286,0.0958904109589041,0.04225352112676056,0.7586206896551724,0.13432835820895522
Everlasting Love,ever ever ever ever ever ever fifth harmony baby ever ever ever everlasting love another always lookin shoulder cause ever wanna miss thinkin daily wait face even know know wait kiss somehow know finally lock eyes that feel gonna needed make feel like dream whoever baby waitin ever everlasting love ever everlasting love never ever givin layin next looking ever everlasting love forever ever kind touch never ever enough baby meant wasting time anybody baby want exceptional original someone deny love already know sounds crazy hope save cause baby mine mine gonna needed make feel like dream whoever baby waitin ever everlasting love ever everlasting love never ever givin layin next looking ever everlasting love forever ever kind touch never ever enough baby meant post everlasting love ever ever ever everlasting love ever ever ever everlasting love ever ever ever everlasting love everlasting love bridge even know name brain darling hardly wait know beautifully insane infinitely promise glad came wait show ever everlasting love every ever everlasting love enough never ever givin layin next looking ever everlasting love ever ever forever ever kind touch never ever enough baby meant baby meant post everlasting love ever ever ever everlasting love ever ever ever everlasting love ever ever ever everlasting love everlasting love,Reflection,2015,250,41,3,3,11,3,2,10,4,0.7848837209302326,joy,intenso,0.9534883720930233,0.043478260869565216,0.05454545454545454,0.35714285714285715,0.0410958904109589,0.028169014084507043,0.3448275862068966,0.05970149253731343
Don’t Wanna Dance Alone,callin girls there tonight hundred percent every single trace weekdays gone there gotta million faces room room gets attention best feel like dancin night long nothing gonna stop want baby come cause wanna dance alone long thinkin bout feelin arms wrapped around body that want baby come cause wanna dance alone floor feel starin across room what waitin want come make move million silhouettes dancin room room wanna gets attention best feel like dancin night long nothing gonna stop want baby come cause wanna dance alone long thinkin bout feelin arms wrapped around body that want baby come cause wanna dance alone bridge come close baby want move slow never know things could come close baby want move slow never know things could best best feel like dancin feel like dancin night long night long nothing gonna stop want want baby come cause wanna dance alone long thinkin bout feelin arms your arms wrapped around body that want baby come cause wanna dance alone lone dance alone wanna dance alone,Reflection,2013,199,16,9,0,8,3,0,7,8,0.5406976744186047,joy,intenso,0.37209302325581395,0.13043478260869565,0.0,0.25,0.0410958904109589,0.0,0.2413793103448276,0.11940298507462686
Suga Mama,flict know want tell want lady deny sexy what make green tryna take guess cash take team baby interlude woah woah suga mama suga mama baby suga mama said said suga mama suga mama suga mama suga mama baby suga mama even though love thought your your post suga mama suga mama suga mama love nobody love like like call lazy food daddy said good ballin dough payin things something gotta change please please baby interlude woah woah woah suga mama suga mama baby suga mama said said suga mama suga mama suga mama suga mama baby suga mama even though love thought your your post suga mama suga mama suga mama your suga mama bridge money money damn thang wish could honey make sang sang money money damn thang what want suga mama suga mama your suga mama baby suga mama said said suga mama suga mama your suga mama suga mama baby suga mama even though love thought even though love thought your your post suga mama suga mama suga mama suga mama suga mama suga mama suga mama,Reflection,2015,229,22,0,6,9,8,2,10,2,0.680232558139535,joy,intenso,0.5116279069767442,0.0,0.10909090909090909,0.2857142857142857,0.1095890410958904,0.028169014084507043,0.3448275862068966,0.029850746268656716
