title,lyrics,Album,release_year,Word Count,joy,sadness,surprise,trust,anger,disgust,anticipation,fear,score,sentiment,filter,joy_norm,sadness_norm,surprise_norm,trust_norm,anger_norm,disgust_norm,anticipation_norm,fear_norm
Miss Movin’ On,breaking down gonna start scratch shake like etch sketch lips saying goodbye eyes finally used took record repeat killed survived comin alive never girl again woah never girl again woah innocence wearing thin heart growing strong call call call miss movin post miss movin broke glass surrounded surrounded remember remember good girl fragile more jumped fence side side whole world electrified electrified longer afraid independence independence never girl again woah never girl again woah innocence wearing thin heart growing strong call call call miss movin bridge everything changing never want back finding gonna enough gonna enough gonna enough never girl again woah never girl again innocence wearing thin heart growing strong call call call miss movin movin post miss movin miss movin miss movin movin,Reflection,2013,159,5,2,4,5,0,1,6,3,0.558139534883721,anticipation,intenso,0.11627906976744186,0.028985507246376812,0.07272727272727272,0.14285714285714285,0.0,0.014084507042253521,0.20689655172413793,0.04477611940298507
Gonna Get Better,gonna leave know better gonna leave know better leave money matter through gonna leave know better know always think always think unsatisfied that tempted kings finest things know truth know always think unhappy paradise that wantin trees growing green know want thought know better babe than think would need house hills need like midas midas thought know better babe than think would need house benz just want love woah gonna leave know better gonna leave know better leave money matter through gonna leave know better know always think always think unsatisfied that tempted kings finest things know truth truth know always think unhappy paradise that wantin trees growing green know want thought know better babe than think would need house hills want like midas midas woah thought know better babe than think would woah need house benz just want love woah gonna leave gonna leave know better gonna leave know better leave money money matter through gonna leave know better better bridge breakdown gonna leave know better gonna leave know better leave money matter through gonna leave know gonna better gonna better gonna leave know better gonna leave know better leave money money matter through gonna leave leave know better better,7/27,2016,246,11,26,29,12,9,4,11,0,0.6162790697674418,surprise,intenso,0.2558139534883721,0.37681159420289856,0.5272727272727272,0.39285714285714285,0.1232876712328767,0.056338028169014086,0.3793103448275862,0.0
Who Are You,monday sent flowers tuesday made feel stupid wednesday world ours thursday prove friday fell back love saturday talk sunday said needed space miss crazy losing hold love baby either want need know need know today will pouring rain tomorrow will make smile bring sorrow gonna lost scared gonna there nobody there today cause still still same post monday heart tuesday screaming wednesday part thursday mean friday shook saturday wrong sunday said needed space miss crazy losing hold love baby either want need know need know today will pouring rain tomorrow will make smile bring sorrow gonna lost scared gonna there nobody there today cause still same interlude bridge strange thing make feel right bring much pain strange face make love hurts where where need know need know today today will pouring rain pouring rain tomorrow will make smile bring sorrow gonna lost scared gonna there nobody there today today cause still still same same,Reflection,2013,190,9,12,3,3,5,1,3,7,0.4360465116279071,sadness,intenso,0.20930232558139536,0.17391304347826086,0.05454545454545454,0.07142857142857142,0.0684931506849315,0.014084507042253521,0.10344827586206896,0.1044776119402985
Lonely Night,attention better listen cause questions late night textin likin every best friend refrain shit together shit together vision that reason keep distance must confused what must confused what room fools around treat mama right another chick side look everywhere eyes gonna lonely lonely lonely lonely lonely night post lonely lonely lonely lonely lonely lonely lonely lonely night lonely lonely lonely lonely lonely lonely lonely lonely night learn lesson permanent detention want love affection then better make good impression refrain shit together shit together vision that reason keep distance must confused bout must confused bout room fools around round treat mama right another chick side when know want baby look everywhere eyes gonna lonely lonely lonely lonely lonely night post lonely lonely lonely lonely lonely lonely lonely lonely night lonely night lonely lonely lonely lonely lonely night lonely lonely lonely lonely night bridge this warnin right have lonely night lonely night this warnin right right have lonely night lonely night breakdown night lonely night woah treat mama right another chick side look everywhere eyes woah gonna lonely lonely lonely lonely lonely night gonna lonely lonely lonely lonely lonely night gonna lonely lonely lonely lonely lonely night,Fifth Harmony,2017,244,8,69,4,7,73,71,7,67,-1.0,anger,intenso,0.18604651162790697,1.0,0.07272727272727272,0.21428571428571427,1.0,1.0,0.2413793103448276,1.0
"Brave, Honest, Beautiful",flict ready ready ready jane fifth harmony waste precious time with nonsense mind criticize more smile worth fightin everythin with perfect porcelain compare gotta remind yourself that amazing babe break every could smilin every gotta remind yourself dance like beyonc shake like shakira cause brave fearless beautiful beautiful whine like rihanna pose like madonna cause brave honest beautiful beautiful girl sell every stadium crowd goes crazy done know beautiful deserve hollywood star everythin with perfect porcelain compare just gotta remind yourself that amazing babe break every could smilin every gotta remind yourself meghan trainor dance like beyonc shake like shakira cause brave fearless beautiful beautiful whine like rihanna pose like madonna cause brave honest beautiful beautiful girl interlude meghan trainor haha said beautiful beautiful meghan bring bass bridge meghan trainor meghan trainor shake shake shake mama show world know wind waist tell stop tell stop tell stop shake shake shake mama show world know confidence help help meghan trainor dance like beyonc shake like shakira cause brave fearless fearless beautiful beautiful woah whine like rihanna whine whine pose like madonna pose like madonna cause brave honest beautiful beautiful girl dance like beyonc shake like shakira shakira shakira cause brave fearless beautiful beautiful whine like rihanna pose like madonna cause brave honest beautiful beautiful girl girl,Reflection,2015,254,34,12,4,17,7,12,9,12,0.5988372093023255,joy,intenso,0.7906976744186046,0.17391304347826086,0.07272727272727272,0.5714285714285714,0.0958904109589041,0.16901408450704225,0.3103448275862069,0.1791044776119403
1000 Hands,tired tired give nothin ever tried perfect somethin like truest everywhere somehow place ever long hold down liberty warm touch pressure fingertips never enough nothin submit wanna feel thousand hands from make feel thousand hands from grab hold soul make feel complete within show these goosebumps skin wear heart sleeve need feel pain would take bullet cause know same warm touch pressure fingertips never enough nothin submit wanna feel thousand hands from make feel thousand hands from want feel thousand thousand hands just wanna feel thousand thousand hands feel thousand hands,7/27,2016,110,2,4,1,4,1,0,5,4,0.4941860465116279,anticipation,intenso,0.046511627906976744,0.057971014492753624,0.01818181818181818,0.10714285714285714,0.0136986301369863,0.0,0.1724137931034483,0.05970149253731343
Bridges,spend time rewind sorry many times remind myself come stories build walls blind ourselves every action there reaction know world cold divide there something inside power grows there something beautiful flaws something calling says build bridges build bridges separate know love conquer hate build bridges bridges walls build bridges walls bridges walls believe beauty love believe really believe every woman fighter believe every stand beside know world cold divide there something inside power grows there something beautiful flaws something calling says build bridges build build bridges separate know love conquer hate build bridges bridges walls build bridges walls bridges walls bridge pray break chains because love worth fighting shed light build pray break chains because love worth fighting shed light build pray break chains because love worth fighting shed light build pray break chains praying because love worth fighting shed light refrain build bridges build pray break chains build bridges because love worth fighting shed light build bridges pray break chains build bridges because love worth fighting shed light build bridges build build bridges build bridges build bridges build bridges build bridges separate build bridges know love conquer hate build bridges build bridges build bridges bridges walls build bridges walls,Fifth Harmony,2017,232,19,3,12,6,9,3,7,9,0.5930232558139534,joy,intenso,0.4418604651162791,0.043478260869565216,0.21818181818181817,0.17857142857142858,0.1232876712328767,0.04225352112676056,0.2413793103448276,0.13432835820895522
Sauced Up,sauced forever young never cause sauced like what what what what what money your flow know fluent code make come bands though drop couple show came refrain disaronno rocks rocks fireball lemon drop lemon drop clock shut talk right right what doin right want problems want power drivin follow sauced forever young never blame drunk love explain tomorrow show rock bass show rock roll cause sauced like what what what sauced sauced feelings sauced feelin bossed make baby what refrain disaronno rocks rocks fireball lemon drop lemon drop clock shut talk right right what doin right want problems want power drivin follow sauced forever young never blame drunk love explain tomorrow show rock bass show rock roll cause sauced like what what what bridge what night feelin ceilin cards table keep hundred baby show made right right what doin right want problems want problems want power drivin drivin follow sauced sauced forever young never blame drunk love blame drunk love babe explain tomorrow show show rock bass show rock roll cause sauced like what post what what sauced sauced woah feelings sauced what feelin bossed woah make what what sauced sauced woah feelings sauced what feelin bossed make what what what what what what,Fifth Harmony,2017,250,11,0,5,13,5,8,10,0,0.627906976744186,trust,intenso,0.2558139534883721,0.0,0.09090909090909091,0.42857142857142855,0.0684931506849315,0.11267605633802817,0.3448275862068966,0.0
Squeeze,night looking wish could read mind dimming light dark going feel only moon guide when alone close give warmth never known face face caught wild embrace this safest place ever known arms around baby arms around baby squeeze only know save arms around baby squeeze squeeze post remember night talking saying words wanna hear most gave heart gave coat cold taking sweet slow when alone close give warmth never known face face caught wild embrace this safest place ever known arms around baby arms around baby squeeze only know save arms around baby squeeze squeeze post arms around baby arms around baby squeeze only know save arms around baby baby squeeze squeeze post would squeeze hold baby,7/27,2016,141,17,2,5,7,1,0,3,1,0.6395348837209303,joy,intenso,0.3953488372093023,0.028985507246376812,0.09090909090909091,0.21428571428571427,0.0136986301369863,0.0,0.10344827586206896,0.014925373134328358
Make You Mad,make make blood veins work baby baby know what mind heart move body every time leave image mind like baby come lock throw come gonna make miss gonna make gonna make sure best ever gonna make miss gonna make gonna make sure best ever post make make night hear call midnight hour that come alive turn light feel power take heat coming inside woah like baby come lock throw come woah gonna make miss gonna make gonna make sure best ever woah woah gonna make miss gonna make make miss gonna make sure best ever post make make make make make make bridge come come come come come what come come come come come gonna make miss make miss gonna make woah gonna make sure best ever best ever baby gonna make miss gonna make love gonna make gonna make sure best ever best ever,Fifth Harmony,2017,181,7,1,1,1,0,0,3,0,0.5406976744186047,joy,intenso,0.16279069767441862,0.014492753623188406,0.01818181818181818,0.0,0.0,0.0,0.10344827586206896,0.0
Scared of Happy,since lost words needles static stutters never knew love hurt feeling heat burn just give good reason drop everythin leave seconds away turnin back around somethin feeling pushin pullin walls fall down usually fearless scared happy usually fearless scared happy afraid nothing afraid used fearless scared happy post scared happy there something good sticking guns blame yourself take step back breathe once this want give good reason drop everythin leave seconds away pullin outside door something feeling pushin pullin that come back more usually fearless scared happy usually fearless scared happy afraid nothing afraid used fearless scared happy happy post scared happy happy bridge when goes down when goes when goes down will still around comin back runnin away usually fearless scared happy usually fearless scared happy fearless afraid nothing afraid used fearless scared happy happy post scared happy scared happy scared happy scared happy scared happy scared happy used fearless scared happy usually fearless scared happy afraid nothin afraid used fearless scared happy,7/27,2016,206,30,8,8,29,6,4,29,25,0.7848837209302326,joy,intenso,0.6976744186046512,0.11594202898550725,0.14545454545454545,1.0,0.0821917808219178,0.056338028169014086,1.0,0.373134328358209
Messy,tell straight feel filter touchin there filter refrain cruel sometimes mind insecure door wonder hard handle dance around house nothin radio scandal runnin mouth crying bedroom floor messy messy admit messy crazy admit changin changin messy messy admit secrets here lights feelin cause hold tongue refrain cruel sometimes mind insecure door wonder hard handle dance around house nothin radio scandal runnin mouth crying bedroom floor messy messy messy admit messy crazy admit changin woah changin messy messy admit admit bridge changin admit admit admit apologies changin changin changin changin admit messy messy admit messy crazy admit admit changin changin changin changin messy messy admit admit post messy messy messy messy baby admit baby babe baby changin changin messy messy admit,Fifth Harmony,2017,178,5,9,2,2,7,24,0,9,0.2441860465116279,disgust,intenso,0.11627906976744186,0.13043478260869565,0.03636363636363636,0.03571428571428571,0.0958904109589041,0.3380281690140845,0.0,0.13432835820895522
Not That Kinda Girl,come pull what benz tellin money spend wanna spend baby please show club what bottles tryna talk shit like gonna follow really really even know know like even know keep staring show like fall think problem looking like kinda girl just cause mean girl want treat like fucked kinda girl wanna like better speak shut tryna tell wanna touch regret know thinking wanna find body wanna know baby think ready baby show something more show there missy elliott looking like kinda girl just cause mean girl want treat like fucked kinda girl kinda girl looking looking like kinda girl that kinda girl just cause mean girl want want treat like fucked kinda girl kinda girl missy elliott kinda girl freak first date first date straight that right make wait make wait look good look great want cake while face tryna taste what think thot forget forget that around block that wanna smash talk trash gets boys boys love love tell freak wife wife tell find girl like like kinda girl give panties looking then looking like kinda girl just cause just cause mean girl know want this baby baby want treat like fucked kinda girl kinda girl looking like kinda girl just cause cause mean girl want want treat like fucked kinda girl kinda girl,7/27,2016,243,14,15,7,11,8,7,10,13,0.4709302325581395,sadness,neutro,0.32558139534883723,0.21739130434782608,0.12727272727272726,0.35714285714285715,0.1095890410958904,0.09859154929577464,0.3448275862068966,0.19402985074626866
We Know,same words thirst different name same jokes laugh guess that game show everything need even though damn fine know better without even cross mind would always doubt believe thing time girls told play game know know probably worked last time girls told play game know post know know know know know know know know know know know know first really ashamed entice chain number phone away maybe stay lane even though damn fine know better without even cross mind would always doubt believe thing time girls told play game know know probably worked last time girls told play game know post know know know woah know know know know know know know know know know know believe thing time girls told play game know,Reflection,2015,158,1,6,3,3,5,3,6,4,0.44767441860465107,sadness,intenso,0.023255813953488372,0.08695652173913043,0.05454545454545454,0.07142857142857142,0.0684931506849315,0.04225352112676056,0.20689655172413793,0.05970149253731343
Like Mariah,tyga doop doop doop doop doop doop love call baby when lightin phone makes want like crazy runnin home runnin home just hear heart beat sweet like honeycomb gotta near cause best ever known make like song hummin hummin beat drum rhythm rhythm fifth harmony your lovin takes higher heart fire when touch body singing like mariah there denying your kisses keep flying when touch body singing like mariah post fifth harmony singing like mariah your name written lips every single little kiss like dream like dream need make wish cause want when like this lose cool make like song hummin hummin beat drum rhythm rhythm fifth harmony your lovin takes higher heart fire when touch body singing like mariah there denying your kisses keep flying when touch body singing like mariah post tyga fifth harmony singing like mariah tyga fire lookin love number supplier wanna wanna ride hottest city heart fire nothin know come pretty pretty pretty pretty sidity like aaliyah mariah carey stay winnin ridin papa love lambo pilot inside angel body king need goddess gotta love tyga fifth harmony your loving takes higher heart fire when touch body singing like mariah there denying your kisses keep flying when touch body singing like mariah post tyga fifth harmony singing like mariah sing tyga fifth harmony singing like mariah singing like mariah singing like mariah,Reflection,2015,269,21,5,4,16,2,1,11,12,0.6627906976744187,joy,intenso,0.4883720930232558,0.07246376811594203,0.07272727272727272,0.5357142857142857,0.0273972602739726,0.014084507042253521,0.3793103448275862,0.1791044776119403
Me & My Girls,play favorite songs scream night long like when girls lights turn loud talk understand word gotta sleep instead karaoke taking duckface selfies right left crazy stupid care people stare wobble diva queen britney demi direction bieber play favorite songs scream night long like when girls dance like watching crack booty poppin like when girls watch post girls girls girls girls girls girls voice gone favorite times like always come along need there rather than crazy freaks crazy stupid care people stare wobble diva queen britney demi direction bieber play favorite songs scream night long like when girls dance like watching crack booty poppin like when girls watch post girls girls girls girls girls girls bridge break down break down break down break break down break down break down break down play favorite songs scream night long like when girls dance like watching crack booty poppin like when girls watch,Reflection,2013,183,8,3,12,9,7,4,7,10,0.5465116279069768,surprise,intenso,0.18604651162790697,0.043478260869565216,0.21818181818181817,0.2857142857142857,0.0958904109589041,0.056338028169014086,0.2413793103448276,0.14925373134328357
Better Together,when together strangers playin around wanna work wanna work thought something missing different baby lookin back really worked really worked because gone sleep alone help want back cause miss said really miss understand better together miss said really really miss understand better together post better better better better better know better together better better better better better know better together watching thinking ever dumb known known late wanna know babe tell could still cause finally know really know because gone sleep alone help want back cause both miss said really said really miss understand better together miss miss said really really miss understand better together post better better better better better know better together better better better better better know better together bridge gone sleep alone help want back cause refrain better better better better better know better together better better better better better know better together miss know miss said really said really miss understand better together miss said really really miss understand better together better better better better better know better together better better better better better know better together,Reflection,2013,222,2,5,1,1,0,1,2,4,0.4534883720930232,sadness,intenso,0.046511627906976744,0.07246376811594203,0.01818181818181818,0.0,0.0,0.014084507042253521,0.06896551724137931,0.05970149253731343
Can You See,searchin somethin somethin that bigger believe refrain knew star close could touch light hearts lead dark waited life feel feelin that feel right open eyes world brighter tell star shine lights tell great meet king kings come follow tell star leap faith promise there army mountain stop refrain knew star close could touch light hearts lead dark tell star star shine lights tell great great meet king kings come follow tell star bridge waited life feel feelin that feel right open eyes world brighter tell star shine lights tell great great meet king kings come follow tell star star post tell star tell star tell star star king kings lord lords tell star tell star meet king kings come follow,The Star,2017,155,18,2,0,19,0,1,18,0,0.7790697674418605,trust,intenso,0.4186046511627907,0.028985507246376812,0.0,0.6428571428571429,0.0,0.014084507042253521,0.6206896551724138,0.0
Voicemail,reached phone number longer service wait call back cause thinkin bout post shake shake shake shake shake shake single ladies shake shake shake shake shake shake pretty ladies club going thinkin bout stay stay girls gettin down watch news keep callin keep callin ignore ignore keep callin keep callin voicemail answer reached phone number that longer service wait call back call back cause thinkin bout reached phone number lover probably lose time start dealin fact that thinkin bout post shake shake shake shake shake shake single ladies shake shake shake shake shake shake pretty ladies what what everythin need include never seen booty movin like mine break down interlude boom boom bounce boom boom bounce boom boom bounce boom boom bounce keep callin keep callin ignore ignore keep callin keep callin keep callin keep callin voicemail answer reached phone number that longer service wait call back cause thinkin bout thinkin bout reached phone number lover probably lose time start dealin fact dealin fact that thinkin bout post shake shake shake shake shake shake shake shake girl single ladies shake shake shake shake girl shake girl shake shake shake pretty ladies bridge make time sorry late through favor later call there reached phone number that longer service wait call back wait wait cause thinkin bout thinkin bout reached phone number lover probably lose time start dealin fact that thinkin bout thinkin bout,7/27,2016,282,6,4,4,10,14,3,20,4,0.5639534883720929,anticipation,intenso,0.13953488372093023,0.057971014492753624,0.07272727272727272,0.32142857142857145,0.1917808219178082,0.04225352112676056,0.6896551724137931,0.05970149253731343
Top Down,blaze cruisin down engine cruisin watch down truck ridin down with down down small town cruisin city where fellas cute girls pretty world know going down lotta money lotta style what what blaze cruisin down engine cruisin watch down truck ridin down with down down post electric city baby mine tonight electric city shine bright electric city baby light electric city think might stay passed real woke realer clique going hard feel come take ride lotta money lotta style what what blaze cruisin down engine cruisin watch down truck ridin down with down down post electric city baby mine tonight electric city shine bright electric city baby light electric city think might stay break blaze cruisin down engine cruisin watch down truck ridin down with down down post electric city baby mine tonight electric city shine bright electric city baby light electric city think might stay,Reflection,2015,174,21,0,15,8,6,0,7,4,0.7151162790697674,joy,intenso,0.4883720930232558,0.0,0.2727272727272727,0.25,0.0821917808219178,0.0,0.2413793103448276,0.05970149253731343
